questionID,originalQuestionID,totalPossiblePoint,AnswerKey,isMultipleChoiceQuestion,includesDiagram,examName,schoolGrade,year,question,subject,category
ACTAAP_2009_5_11,11,1,D,1,0,ACTAAP,5,2009,"If Lisa wants to experiment with bean plants, which of these is the best example of a hypothesis? (A) Bean plants come in many types. (B) Fertilizer is good for bean plants. (C) All bean plants are related to each other. (D) Fertilizer will make bean plants grow taller.",,Train
Mercury_SC_406071,406071,1,D,1,0,Mercury,5,2015,"A jeweler melts gold to make jewelry. As the gold melts, the mass (A) increases. (B) decreases. (C) is destroyed. (D) stays the same.",,Train
MCAS_2007_8_5185,5185,1,B,1,0,MCAS,8,2007,Which of the following tools is most useful for tightening a small mechanical fastener? (A) chisel (B) pliers (C) sander (D) saw,,Train
Mercury_7269115,7269115,1,B,1,0,Mercury,9,2015,"Oil, coal, and natural gas are fossil fuels formed under what conditions? (A) low temperature and high pressure (B) high temperature and high pressure (C) low temperature and low pressure (D) high temperature and low pressure",,Train
NYSEDREGENTS_2016_4_3,3,1,C,1,0,NYSEDREGENTS,4,2016,Some birds build nests in the spring. This nest building is a seasonal adaptation that occurs to help the birds (A) fly south (B) find food (C) protect their young (D) survive the winter,,Train
NYSEDREGENTS_2006_4_5,5,1,D,1,0,NYSEDREGENTS,4,2006,Which tool is used to measure the volume of a liquid? (A) balance (B) ruler (C) thermometer (D) graduated cylinder,,Train
NYSEDREGENTS_2004_4_11,11,1,C,1,0,NYSEDREGENTS,4,2004,The functions of a plant's roots are to support the plant and (A) make food (B) produce fruit (C) take in water and nutrients (D) aid in germination,,Train
Mercury_406730,406730,1,D,1,0,Mercury,6,2015,All of the inherited traits that are passed to offspring during asexual reproduction come from a single (A) egg. (B) sperm. (C) virus. (D) parent.,,Train
MCAS_2003_8_3,3,1,A,1,0,MCAS,8,2003,What energy transformation occurs when an electric lamp is turned on? (A) electrical energy to light and heat energy (B) light energy to electrical and mechanical energy (C) heat energy to electrical and light energy (D) electrical energy to mechanical and heat energy,,Train
Mercury_7218715,7218715,1,C,1,0,Mercury,8,2015,Which phase change in the atmosphere forms clouds? (A) evaporation (B) freezing (C) condensation (D) melting,,Train
Mercury_7274330,7274330,1,D,1,0,Mercury,8,2015,Where are the most reactive nonmetals located on the periodic table? (A) the uppermost complete row of the table (B) the rows at the bottom of the table connecting two sections (C) the column at the far left side of the table (D) the second column from the right side of the table,,Train
Mercury_SC_401808,401808,1,A,1,0,Mercury,5,2015,Who was a leading authority on continental drift in the early 1900s? (A) Alfred Wegener (B) Albert Einstein (C) Charles Richter (D) Charles Darwin,,Train
NYSEDREGENTS_2006_8_3,3,1,3,1,0,NYSEDREGENTS,8,2006,"In addition to oxygen, which gases make up the largest percentage of Earth's atmosphere? (1) hydrogen, helium, and water vapor (2) hydrogen, methane, and ozone (3) carbon dioxide, water vapor, and nitrogen (4) carbon dioxide, methane, and helium",,Train
AKDE&ED_2012_4_31,31,1,B,1,0,Alaska Dept. of Education & Early Development,4,2012,"For many years, people have been curious about the stars. In the past, people have shared what they knew about the stars through stories and drawings. Which pair of tools would be most helpful for people today to gather and share information about stars? (A) a notebook and a calculator (B) a telescope and a computer (C) a calculator and a microscope (D) a microscope and a telescope",,Train
Mercury_7163888,7163888,1,A,1,0,Mercury,8,2015,"During a presentation on astronomy, Professor Williams discussed various measurements in space. Which objects was she referring to when she talked about how astronomical units (AU) were determined? (A) the Sun and Earth (B) the Moon and Earth (C) the inner and outer planets (D) the Sun and the closest star",,Train
NCEOGA_2013_5_54,54,1,C,1,0,North Carolina READY End-of-Grade Assessment,5,2013,"As more people have moved to the beach, the sea turtle population has decreased. Which is most likely the cause of this decrease? (A) tropical storms (B) increase in predators (C) habitat loss (D) warmer temperatures",,Train
Mercury_SC_400605,400605,1,D,1,0,Mercury,5,2015,The skin of a chameleon can change colors to help it blend with its surroundings. How would this adaptation most likely help a chameleon survive? (A) by scaring predators away from the chameleon (B) by attracting prey animals to the chameleon (C) by sending a signal to other chameleons (D) by helping the chameleon hide from its predators,,Train
Mercury_7120715,7120715,1,B,1,0,Mercury,8,2015,A student examines a new watch design. The watch has a small solar cell on its face. The main function of the solar cell is to (A) reduce the cost of the watch. (B) provide an energy source for the watch. (C) make the watch more attractive. (D) stop the watch from speeding up.,,Train
MCAS_2008_8_5715,5715,1,B,1,0,MCAS,8,2008,The presence of which of the following geological features provides the best evidence that glaciers once covered an area? (A) wide riverbeds (B) U-shaped valleys (C) underground caves (D) groundwater springs,,Train
VASoL_2010_5_24,24,1,B,1,0,Virginia Standards of Learning - Science,5,2010,Which of these is a way the people of Virginia can help restore a natural ecosystem? (A) Burn their trash (B) Plant native plants (C) Feed leftover meals to deer (D) Drain automobile oil into the grass,,Train
Mercury_SC_400029,400029,1,D,1,0,Mercury,5,2015,"A student wants to figure out how many calories are needed to perform various activities. A list of some everyday activities is made, and the number of calories burned during each activity is recorded. Which method is the best way for the student to display and evaluate the information? (A) write a paragraph (B) make a line graph (C) develop a formula (D) create a table",,Train
Mercury_7086730,7086730,1,C,1,0,Mercury,7,2015,Sedimentary deposits formed from organic material tend to include a high amount of (A) iron. (B) nickel. (C) carbon. (D) silicon.,,Train
Mercury_7016100,7016100,1,B,1,0,Mercury,8,2015,"According to the Big Bang Theory, which element most likely formed first?  (A) carbon dioxide (B) hydrogen (C) oxygen (D) nitrogen",,Train
Mercury_SC_408364,408364,1,C,1,0,Mercury,5,2015,Tim and Carla play catch with a ball. Which term describes the motion of a ball? (A) shape (B) size (C) speed (D) weight,,Train
Mercury_SC_401368,401368,1,C,1,0,Mercury,5,2015,"Which set of equipment would be best to use when investigating what is found in a sample of pond water? (A) net, gloves, specimen bags (B) beaker, calculator, graph paper (C) microscope, eye dropper, slides (D) measuring tape, thermometer, clipboard",,Train
Mercury_7009765,7009765,1,A,1,0,Mercury,8,2015,The Theory of Plate Tectonics revolutionized scientific thought because it (A) explained the movement of oceanic and continental crusts. (B) demonstrated how tidal forces affect coastlines. (C) mapped the pattern and frequency of earthquakes. (D) explained the mineral differences between continents.,,Train
AKDE&ED_2008_8_52,52,1,A,1,0,Alaska Department of Education and Early Development,8,2008,How does repeating an experiment improve the likelihood of obtaining accurate results?     (A) Data can be compared. (B) Time can be decreased. (C) Equipment can be added. (D) Procedures can be changed.,,Train
Mercury_401504,401504,1,B,1,0,Mercury,8,2015,One hundred grams of water and 100 grams of vegetable oil are heated in identical containers at 70°C for 5 minutes. Their temperatures at the end of 5 minutes are different due to the difference in which property? (A) volume (B) specific heat (C) conductivity (D) chemical energy,,Train
Mercury_SC_401150,401150,1,B,1,0,Mercury,5,2015,There are MORE hours of sunlight in the Northern Hemisphere during which season? (A) spring (B) summer (C) fall (D) winter,,Train
Mercury_SC_415695,415695,1,C,1,0,Mercury,3,2015,Which force produces energy as heat? (A) pull (B) gravity (C) friction (D) magnetic,,Train
Mercury_7109270,7109270,1,A,1,0,Mercury,9,2015,Biologists have discovered that the beluga whales of Canada's St. Lawrence River have the highest rates of cancer among animals. What is most likely the reason for this high incidence of cancer in these whales? (A) chemical and pollutant runoff into the ocean (B) average temperatures increased in the region (C) depletion of natural prey from the ecosystem (D) increased levels of carbon dioxide in the atmosphere,,Train
Mercury_7007823,7007823,1,C,1,0,Mercury,8,2015,"Reading from left to right, elements in the same period on the Periodic Table of the Elements (A) have the same reactivity. (B) decrease in atomic mass. (C) increase in atomic number. (D) have the same number of electrons.",,Train
Mercury_7044660,7044660,1,D,1,0,Mercury,8,2015,A device that converts light energy into electricity used in many handheld calculators is a (A) battery. (B) photocell. (C) photo generator. (D) photovoltaic cell.,,Train
ACTAAP_2007_7_12,12,1,D,1,0,ACTAAP,7,2007,Which most accurately describes a circle (pie) graph? (A) used to demonstrate change in temperature only (B) used to demonstrate change that is continuous (C) used to demonstrate change that is not continuous (D) used to describe how part of the data relates to all of the data,,Train
MCAS_2001_8_6,6,1,C,1,0,MCAS,8,2001,Which organisms benefit in the relationship between bees and flowering plants? (A) only the bees (B) only the flowering plants (C) both the bees and the flowering plants (D) neither the bees nor the flowering plants,,Train
Mercury_7122763,7122763,1,C,1,0,Mercury,8,2015,"The orbit of Earth is almost circular and has a period of about 365 days. Compared to the orbit of Earth, which of these objects usually have highly elliptical orbits and can have periods of over 1000 years? (A) asteroids (B) meteorites (C) comets (D) moons",,Train
Mercury_7236653,7236653,1,C,1,0,Mercury,9,2015,How is the theory of plate tectonics different from a hypothesis regarding a certain aspect of plate movement? (A) The theory addresses an Earth-science topic. (B) The theory may change if new evidence emerges. (C) The theory explains a number of related observations. (D) The theory can be evaluated by a single-variable experiment.,,Train
Mercury_7113943,7113943,1,A,1,0,Mercury,8,2015,A large quantity of heavy rain falling in a short time period will most likely (A) reduce the amount of nutrients in the soil. (B) increase the number of minerals in the soil. (C) reduce oxygen levels in the soil. (D) increase the temperature of the soil.,,Train
Mercury_7197295,7197295,1,B,1,0,Mercury,9,2015,An artificial pacemaker is a device that regulates the beat of the heart by an electrical stimulus. Some early pacemakers were powered by batteries and were worn externally with wires passing through the skin to the surface of the heart. Modern pacemakers are now much smaller and are implanted surgically. Which most likely has increased the lifespan and effectiveness of artificial pacemakers? (A) the development of thinner wires (B) the invention of lithium batteries (C) mass production of pacemaker parts (D) reducing the cost of producing pacemakers,,Train
TIMSS_2003_8_pg93,pg93,1,A,1,0,TIMSS,8,2003,A balloon filled with helium gas is set free and starts to move upward. Which of the following best explains why the helium balloon moves upward? (A) The density of helium is less than the density of air. (B) The air resistance lifts the balloon up. (C) There is no gravity acting on the helium balloons. (D) The wind blows the balloon upward.,,Train
Mercury_416463,416463,1,A,1,0,Mercury,7,2015,"Oscar and Andre used a microscope to observe a sample of pond water and drew an example of each type of organism they saw. Then they compared their drawings. They discovered that their drawings of a euglena and a paramecium were alike, but their amoeba drawings had very different shapes. What are two things that Oscar's amoeba could have been doing that made his drawing look different from Andre's? (A) eating and moving (B) moving and digesting (C) digesting and excreting (D) excreting and eating",,Train
Mercury_SC_401279,401279,1,A,1,0,Mercury,5,2015,The reading on a barometer rises when the air (A) pressure increases. (B) pressure decreases. (C) speed increases. (D) speed decreases.,,Train
CSZ10373,CSZ10373,1,C,1,0,California Standards Test - Science,5,2006,Which of the following processes is responsible for changing liquid water into water vapor? (A) photosynthesis (B) condensation (C) evaporation (D) precipitation,,Train
Mercury_7032585,7032585,1,B,1,0,Mercury,8,2015,"In an atom, protons plus neutrons make up the atom's (A) electric charge. (B) atomic mass. (C) atomic number. (D) electron number.",,Train
Mercury_7212485,7212485,1,A,1,0,Mercury,8,2015,A generator converts mechanical energy to electrical energy by using a conducting metal loop turning in a (A) magnetic field. (B) gravitational field. (C) steel sphere. (D) copper sphere.,,Train
Mercury_SC_405233,405233,1,C,1,0,Mercury,3,2015,"Deer live in forest for shelter. If the forest was cut down, which situation would most likely happen? (A) The deer would find shelter in a different habitat. (B) The deer would wait for the forest to grow back. (C) The deer would move to another forest area. (D) The deer would change the type of foods they eat.",,Train
Mercury_7011095,7011095,1,B,1,0,Mercury,8,2015,Which physical property is important to have in a material used in cookware? (A) poor conductor of heat (B) good conductor of heat (C) low flexibility (D) high flexibility,,Train
MEA_2013_8_5,5,1,B,1,0,MEA,8,2013-2014,Which sentence describes a characteristic of offspring produced by sexual reproduction? (A) The offspring have half the amount of genetic material as the parents. (B) The offspring contain genetic material from both parents. (C) The female offspring contain only genes from the mother. (D) The male offspring contain only genes from the father.,,Train
NCEOGA_2013_8_54,54,1,C,1,0,North Carolina READY End-of-Grade Assessment,8,2013,What is involved in creating genetically modified bacteria? (A) allowing them to reproduce freely (B) changing their food source (C) using biotechnology techniques (D) growing them on selected plants,,Train
MCAS_2008_5_5622,5622,1,C,1,0,MCAS,5,2008,Which of the following structures does a frog develop as it changes from a tadpole to an adult frog? (A) eyes (B) heart (C) lungs (D) tail,,Train
Mercury_SC_415703,415703,1,B,1,0,Mercury,3,2015,One cause of heat in a car engine is caused by friction between parts. Which of these reduces the amount of heat produced by friction? (A) fan (B) oil (C) gasoline (D) battery,,Train
Mercury_7166653,7166653,1,B,1,0,Mercury,7,2015,"The primary functions of the digestive system are to break down food, absorb nutrients and excrete wastes. Once food is absorbed, what system is responsible for carrying the nutrients to the body cells? (A) respiratory system (B) circulatory system (C) nervous system (D) skeletal system",,Train
NAEP_2005_4_S13+4,S13+4,1,A,1,0,NAEP,4,2005,"If you breathe on a mirror, part of the mirror clouds up. What are you actually seeing when you see the mirror cloud up? (A) Water droplets that formed from cooled water vapor in your breath (B) Carbon dioxide that you are breathing out from your lungs (C) Oxygen that you are breathing out from your lungs (D) Cooled nitrogen in the air around you",,Train
VASoL_2011_5_35,35,1,A,1,0,Virginia Standards of Learning - Science,5,2011,"The surface of the Moon is made up of (A) craters, highlands, and flat areas (B) swirling gases (C) large bodies of water (D) a mixture of gases and water",,Train
NYSEDREGENTS_2009_8_39,39,1,2,1,0,NYSEDREGENTS,8,2009,Which sequence correctly shows the levels of increasing organization in the human body? (1) tissues -> cells -> organ systems -> organs (2) cells -> tissues -> organs -> organ systems (3) organs -> organ systems -> cells -> tissues (4) organ systems -> organs -> tissues -> cells,,Train
Mercury_7213063,7213063,1,D,1,0,Mercury,8,2015,Which layer of the atmosphere contains the greatest amount of water vapor? (A) thermosphere (B) mesosphere (C) stratosphere (D) troposphere,,Train
Mercury_7121783,7121783,1,D,1,0,Mercury,7,2015,What should a scientist do to help make sure the results of an experiment are unbiased? (A) Keep the results a secret. (B) Do the math without a calculator. (C) Change all of the variables in the experiment. (D) Ask other scientists to attempt to reproduce the results.,,Train
Mercury_7205993,7205993,1,A,1,0,Mercury,8,2015,Which property of water allows it to dissolve many different substances? (A) It is a polar molecule. (B) It contains hydrogen atoms. (C) It has a high melting point. (D) It has a low density.,,Train
Mercury_7218838,7218838,1,A,1,0,Mercury,8,2015,"Nevada is much drier than regions in California that are at the same latitude. Compared to these regions in California, which feature of Nevada contributes most to this dry climate? (A) mountain ranges to the west (B) high mean elevation (C) frequent earthquakes (D) soil with a high sand content",,Train
Mercury_7221305,7221305,1,B,1,0,Mercury,8,2015,A chemist observed bubbling and fizzing after adding an acid solution to a white powdery substance in a beaker. Which of the following can be inferred? (A) The acid boiled when poured into the beaker. (B) The acid and powder formed a new product. (C) A physical reaction produced a gas mixture. (D) A reaction occurred that produced heat.,,Train
Mercury_LBS10185,LBS10185,1,C,1,0,Mercury,6,2015,Which of the following is visible through a reflecting telescope? (A) planets around other stars (B) black holes in deep space (C) moons around Jupiter (D) surface of Saturn,,Train
Mercury_7081690,7081690,1,B,1,0,Mercury,7,2015,A student is using hydrochloric acid in an investigation. Which piece of safety equipment is most important during this investigation? (A) mask (B) goggles (C) fire extinguisher (D) disinfectant spray,,Train
Mercury_7092103,7092103,1,C,1,0,Mercury,8,2015,"Generally, the deeper rock layers of Earth are older than shallower rock layers. How can the collision of two tectonic plates change the order of the rock layers? (A) The rock layers contain pollutants that dissolve soil. (B) The rock layers lack water due to extended droughts. (C) The rock layers are compressed forming faults and folds. (D) The rock layers are moved closer to rivers which erode landforms.",,Train
Mercury_7044538,7044538,1,C,1,0,Mercury,8,2015,Which instrument should a student use to best examine bacteria? (A) telescope (B) hand lens (C) microscope (D) computer probes,,Train
MEAP_2005_5_37,37,1,C,1,0,MEAP,5,2005,Matter that is vibrating is producing ___. (A) gas (B) light (C) sound (D) shadows,,Train
Mercury_7165900,7165900,1,D,1,0,Mercury,8,2015,Falling and rising air and water molecules inside of clouds are believed to be factors in the formation of lightning. Which kind of energy transfer is taking place to cause this weather phenomenon? (A) electrical to thermal (B) thermal to mechanical (C) chemical to mechanical (D) mechanical to electrical,,Train
NYSEDREGENTS_2004_4_2,2,1,D,1,0,NYSEDREGENTS,4,2004,"Sleet, rain, snow, and hail are forms of (A) erosion (B) evaporation (C) groundwater (D) precipitation",,Train
Mercury_SC_400384,400384,1,D,1,0,Mercury,5,2015,A windstorm knocks down many trees in a national park. Timber companies want to get rid of the fallen trees. How would this most likely harm the park ecosystem? (A) reduces the risk of fire (B) decreases erosion problems (C) increases the risk of drought (D) removes available nutrients,,Train
TIMSS_2003_4_pg71,pg71,1,B,1,0,TIMSS,4,2003,A plant has yellow flowers. What best explains why the flowers are yellow? (A) The sunshine colored the flowers yellow. (B) The flowers of the parent plants were yellow. (C) It was very warm when they flowered. (D) It rained every day.,,Train
Mercury_SC_401203,401203,1,C,1,0,Mercury,5,2015,Which tool is used to determine the mass of an object? (A) ruler (B) beaker (C) balance (D) thermometer,,Train
Mercury_SC_401807,401807,1,C,1,0,Mercury,5,2015,Prairie dogs can run very quickly. This adaptation enables the prairie dog to (A) attract mates. (B) intimidate predators. (C) escape from predators. (D) chase after their young.,,Train
Mercury_7026915,7026915,1,C,1,0,Mercury,8,2015,"A student has a liquid that does not mix with water. To predict whether the liquid will float on water or sink beneath it, which tools should be used to examine the liquid? (A) ruler and compass (B) microscope and voltmeter (C) graduated cylinder and balance (D) thermometer and Bunsen burner",,Train
Mercury_SC_409179,409179,1,B,1,0,Mercury,5,2015,Samuel investigated the effect of temperature on the growth of snapdragons. He recorded the results from the investigation and found that snapdragons do not grow well in low temperatures. What is the purpose of this conclusion in the scientific process? (A) It helps to organize the data. (B) It helps to evaluate the hypothesis. (C) It helps to prepare for an investigation. (D) It helps to collect information from observations.,,Train
TIMSS_2011_8_pg6,pg6,1,A,1,0,TIMSS,8,2011,Which of the following best describes the purpose of cellular respiration? (A) to provide energy for cell activities (B) to produce sugar for storage in cells (C) to release oxygen for breathing (D) to supply carbon dioxide for photosynthesis,,Train
MCAS_2016_5_9,9,1,C,1,0,MCAS,5,2016,"In a meadow ecosystem, mice receive most of the energy they need to survive directly from which of the following sources? (A) minerals (B) oxygen (C) plants (D) water",,Train
Mercury_7252700,7252700,1,C,1,0,Mercury,7,2015,Which environmental stimulus causes leaves on certain trees to change color in autumn? (A) loss of nutrients in the forest soil (B) lower air humidity in the forest (C) changes to amount of light (D) competition for survival,,Train
NYSEDREGENTS_2011_4_2,2,1,A,1,0,NYSEDREGENTS,4,2011,How does the length of daylight in New York State change from summer to fall? (A) It decreases. (B) It increases. (C) It remains the same.,,Train
Mercury_402570,402570,1,B,1,0,Mercury,8,2015,What is the name of the product formed from the reaction shown below? 4Fe(III) + 3O_{2} -> 2Fe_{2}O_{3} (A) iron (II) oxide (B) iron (III) oxide (C) oxygen ferrite (D) diferrous trioxide,,Train
Mercury_186270,186270,1,A,1,0,Mercury,8,2015,What type of galaxy is the Milky Way? (A) spiral (B) elliptical (C) irregular (D) oval,,Train
Mercury_405939,405939,1,D,1,0,Mercury,6,2015,One thing that all human cells have in common is that they (A) control the brain. (B) make food. (C) move blood. (D) take in energy.,,Train
Mercury_7012933,7012933,1,D,1,0,Mercury,8,2015,Which two systems of the body are interacting when a runner sprains his ankle? (A) the nervous system and the digestive system (B) the digestive system and the circulatory system (C) the respiratory system and the nervous system (D) the muscular system and the nervous system,,Train
MCAS_2015_5_12,12,1,A,1,0,MCAS,5,2015,Jupiter is the largest planet in the solar system. It rotates on its axis once about every 10 hours. What time period on Earth would be 10 hours long if Earth rotated on its axis once every 10 hours? (A) a day (B) a week (C) a month (D) a year,,Train
MSA_2013_8_7,7,1,C,1,0,MSA,8,2013,The elements sulfur (S) and oxygen (O2) combine to form a substance called sulfur dioxide (SO2). Sulfur dioxide is also formed when coal and oil are burned. Sulfur dioxide can best be described as (A) a metal (B) an atom (C) a compound (D) a nonreactive gas,,Train
Mercury_SC_406619,406619,1,C,1,0,Mercury,4,2015,Which is a major difference between the life cycles of different types of plants? (A) the way they die (B) the energy they use (C) the way they reproduce (D) the way they make food,,Train
Mercury_7058363,7058363,1,D,1,0,Mercury,8,2015,Sunlight passes through the windows of a car and causes the car seats to get hot. Which type of energy flow is involved in heating the seats? (A) conduction (B) convection (C) insulation (D) radiation,,Train
Mercury_7010955,7010955,1,C,1,0,Mercury,8,2015,"When a large oak tree is cut down in a forest, it leaves a gap in the forest canopy which allows smaller trees to quickly grow in the available sunlight. Which interaction is best represented among the smaller trees? (A) parasitism (B) mutualism (C) competition (D) commensalism",,Train
Mercury_7044205,7044205,1,D,1,0,Mercury,8,2015,How long does it take for the Moon to rotate on its axis? (A) one day (B) one year (C) one week (D) one month,,Train
NYSEDREGENTS_2004_4_29,29,1,B,1,0,NYSEDREGENTS,4,2004,What is one way that humans can maintain good health? (A) sleep all day (B) exercise daily (C) eat snacks often (D) stay up late,,Train
OHAT_2007_8_41,41,1,B,1,0,Ohio Achievement Tests,8,2007,Which is an example of a group of cells with a common structure and function? (A) stomach (B) muscle tissue (C) mitochondria (D) digestive system,,Train
Mercury_182315,182315,1,B,1,0,Mercury,9,2015,"Sickle cell anemia is a genetic disease caused by an autosomal recessive gene. If each parent carries one sickle cell allele, what are the chances that their child will have sickle cell anemia? (A) no chance (B) one in four (C) two in four (D) three in four",,Train
ACTAAP_2012_7_8,8,1,B,1,0,ACTAAP,7,2012,Which statement describes animal embryos? (A) display all the features of an adult (B) represent the earliest stage of development (C) have the same number of cells as a fertilized egg (D) have half the number of chromosomes as an adult,,Train
