questionID,originalQuestionID,totalPossiblePoint,AnswerKey,isMultipleChoiceQuestion,includesDiagram,examName,schoolGrade,year,question,subject,category
MEA_2013_8_17,17,1,B,1,0,MEA,8,2013-2014,"A geologist found fossils of horse bones in different rock layers of a canyon. The fossils in the lower levels show shorter bones than those in the upper-level fossils. Which conclusion is based on the geologist's observations? (A) Horse's reproduce using two parents. (B) Horse's became larger over time. (C) Smaller Horse's went extinct, and then larger Horse's formed. (D) Smaller Horse's are better suited to the environment than larger Horse's.",,Train
Mercury_7267820,7267820,1,D,1,0,Mercury,7,2015,Which of the following is a reason life in the outermost planets is less likely than life on planets nearer the Sun? (A) They have too little mass. (B) They have too much mass. (C) Their surfaces are extremely hot. (D) Their surfaces are extremely cold.,,Train
NCEOGA_2013_8_2,2,1,A,1,0,North Carolina READY End-of-Grade Assessment,8,2013,Which statement best explains how periods on the periodic table are organized? (A) increasing atomic number from left to right (B) increasing number of neutrons from left to right (C) decreasing number of electrons from left to right (D) decreasing atomic mass number from left to right,,Train
Mercury_SC_408781,408781,1,D,1,0,Mercury,5,2015,Nonrenewable sources of energy have limited supplies. Researchers are developing devices that will make renewable energy more available. Which is a source of renewable energy? (A) coal (B) gasoline (C) oil (D) wind,,Train
Mercury_7268100,7268100,1,D,1,0,Mercury,7,2015,Which of these living things in a grassland ecosystem depend on the presence of a variety of bacteria and other microorganisms in the soil? (A) worms only (B) green plants only (C) plants and animals only (D) all the organisms in the ecosystem,,Train
Mercury_7136080,7136080,1,A,1,0,Mercury,7,2015,An ecosystem is a community of organisms interacting with their physical environment. Why are decomposers an important part of ecosystems? (A) They break down dead organisms to return nutrients to the soil. (B) They produce their own food for survival. (C) They play a role in preventing weathering and erosion. (D) They provide most of the energy to consumers.,,Train
NYSEDREGENTS_2011_8_26,26,1,4,1,0,NYSEDREGENTS,8,2011,Which term identifies a group of cells that work together to perform a similar function? (1) molecule (2) organ (3) organism (4) tissue,,Train
Mercury_7015873,7015873,1,B,1,0,Mercury,8,2015,"Which of these statements is not considered part of the Big Bang Theory? (A) The universe is expanding. (B) The universe never changes. (C) The universe began in a hot, dense state. (D) The universe began at a single point and time.",,Train
Mercury_7194338,7194338,1,A,1,0,Mercury,9,2015,Cells in the body use oxygen (O2) for cellular respiration. Which is the result of cellular respiration? (A) ATP is produced and carbon dioxide (CO2) is released. (B) ATP is consumed and carbon dioxide (CO2) is released. (C) ATP is produced and carbon dioxide (CO2) is absorbed. (D) ATP is consumed and carbon dioxide (CO2) is absorbed.,,Train
Mercury_7068548,7068548,1,B,1,0,Mercury,8,2015,Which geologic process is absent from the Gulf Coast states? (A) beach development (B) subduction zones (C) weathering (D) erosion,,Train
NYSEDREGENTS_2016_4_11,11,1,B,1,0,NYSEDREGENTS,4,2016,The human body gets the energy it needs for growth and repair directly from (A) soil (B) food (C) sunlight (D) water,,Train
Mercury_7085173,7085173,1,A,1,0,Mercury,7,2015,In what type of rock would a geologist most likely find evidence of ancient life? (A) sedimentary (B) foliated (C) metamorphic (D) volcanic,,Train
ACTAAP_2010_5_3,3,1,B,1,0,ACTAAP,5,2010,"During the Apollo 14 moon landing, astronauts played golf on the moon. Which of the following would be less on the moon than on Earth? (A) The mass of the golf ball (B) The weight of the golf ball (C) The mass and size of the golf ball (D) The weight and size of the golf ball",,Train
Mercury_SC_400596,400596,1,A,1,0,Mercury,5,2015,"Evaporation, condensation, and precipitation are all processes which occur in the (A) water cycle. (B) energy cycle. (C) carbon cycle. (D) nitrogen cycle.",,Train
AIMS_2009_4_10,10,1,A,1,0,AIMS,4,2009,Directions Read the information about wind erosion then answer the question. Wind can cause erosion that changes the surface of the Earth. Wind erosion can have negative effects on the environment by removing soil and polluting the air during dust storms. Walter wanted to find out if faster wind speeds increased the amount of wind erosion. Which instrument should he use to measure wind speed? (A) anemometer (B) barometer (C) rain gauge (D) thermometer,,Train
CSZ_2008_5_CSZ10104,CSZ10104,1,B,1,0,California Standards Test - Science,5,2008,Where does oxygen-rich blood go after leaving the lungs? (A) the brain. (B) the heart. (C) the kidney. (D) the stomach.,,Train
MDSA_2008_5_1,1,1,C,1,0,Maryland School Assessment - Science,5,2008,Chemical pesticides are sometimes sprayed on crops to kill insects that eat the crops. People have different viewpoints about the use of pesticides on crops. What might be a concern about using pesticides on the crops? (A) Will the food ripen? (B) Will the food stay fresh? (C) Will the food harm humans? (D) Will the food harm bugs in the home?,,Train
Mercury_SC_405295,405295,1,D,1,0,Mercury,5,2015,The number of fish in a lake suddenly increases. How will the increase most likely affect the lake? (A) There will be less water in the lake. (B) More plants will grow in the lake. (C) More frogs will live in the lake. (D) There will be fewer insects in the lake.,,Train
AKDE&ED_2012_8_24,24,1,B,1,0,Alaska Department of Education & Early Development,8,2012,Which statement correctly describes a relationship between two human body systems? (A) The digestive system absorbs nutrients which are transported by the nervous system. (B) The digestive system absorbs nutrients which are transported by the circulatory system. (C) The circulatory system exchanges gases which are transported by the nervous system. (D) The circulatory system exchanges gases which are transported by the digestive system.,,Train
AKDE&ED_2012_8_12,12,1,A,1,0,Alaska Department of Education & Early Development,8,2012,Which statement best explains Earth's day and night cycle?    (A) Earth rotates once each day on its axis. (B) Earth revolves around the Sun each year. (C) The Sun is closest to Earth during the day. (D) The tilt of Earth changes throughout the year.,,Train
NCEOGA_2013_5_S1,S1,1,A,1,0,North Carolina READY End-of-Grade Assessment,5,2013,What is the first thing a student should do if an accident happens during a science experiment? (A) report to the teacher (B) clean the laboratory station (C) locate the nearest exit (D) put on safety goggles,,Train
Mercury_178115,178115,1,B,1,0,Mercury,8,2015,Which of the following helps keep the Moon in its orbit? (A) friction (B) gravity (C) longitude (D) latitude,,Train
NCEOGA_2013_5_44,44,1,D,1,0,North Carolina READY End-of-Grade Assessment,5,2013,Which process allows green plants to control the amount of water stored in their leaves? (A) photosynthesis (B) condensation (C) respiration (D) transpiration,,Train
Mercury_183698,183698,1,C,1,0,Mercury,7,2015,What is a job of white blood cells? (A) transport oxygen (B) remove waste (C) fight disease (D) enable reproduction,,Train
Mercury_SC_LBS10028,LBS10028,1,B,1,0,Mercury,4,2015,Which is an example of kinetic energy? (A) a book sitting on a shelf (B) a ball rolling down a hill (C) a runner about to start a race (D) a window getting hot from the sun,,Train
Mercury_7216930,7216930,1,D,1,0,Mercury,8,2015,A new mutation that occurs in which type of cell can be passed on to offspring? (A) blood cell (B) nerve cell (C) brain cell (D) egg cell,,Train
Mercury_7004603,7004603,1,A,1,0,Mercury,8,2015,"When too much salt is detected in the bloodstream, the brain secretes a hormone that helps the body retain water by reducing the amount of urine produced. This is an example of (A) a feedback loop. (B) an acquired trait. (C) a balanced ecosystem. (D) a symbiotic relationship.",,Train
Mercury_7026880,7026880,1,C,1,0,Mercury,8,2015,Which of these is a safe practice in a laboratory investigation when working with chemicals? (A) pouring unused chemicals down the sink (B) mixing leftover chemicals in one container (C) wearing safety goggles when working with chemicals (D) returning unused chemicals to the original container,,Train
Mercury_7015593,7015593,1,B,1,0,Mercury,8,2015,Which change in the environment would have a negative effect on the survival of a species in an ecosystem? (A) increase in the population of prey (B) introduction of a competing species (C) decrease in the population of predators (D) increase in genetic diversity of the species,,Train
Mercury_7084333,7084333,1,A,1,0,Mercury,7,2015,An element is identified by (A) its number of protons. (B) the atomic mass. (C) the type of charge. (D) its number of isotopes.,,Train
VASoL_2008_3_2,2,1,B,1,0,Virginia Standards of Learning - Science,3,2008,Which of these dissolve in water? (A) Sand grains (B) Sugar cubes (C) Plastic straws (D) Wooden spoons,,Train
OHAT_2010_5_43,43,1,C,1,0,Ohio Achievement Tests,5,2010,What is the main function of a plant stem? (A) to collect pollen from other plants to make seeds (B) to absorb water and plant nutrients from the soil (C) to carry food and water to the rest of the plant (D) to make food for the plant,,Train
NYSEDREGENTS_2011_8_12,12,1,1,1,0,NYSEDREGENTS,8,2011,Naturally occurring variations within a species are mainly the result of mutations and (1) sexual reproduction (2) dynamic equilibrium (3) metabolism (4) camouflage,,Train
CSZ30112,CSZ30112,1,C,1,0,California Standards Test,8,2009,"As a sample of water turns to ice,     (A) new molecules are formed. (B) the mass of the sample is increased. (C) the arrangement of the molecules changes. (D) energy is absorbed by the molecules.",,Train
Mercury_SC_413077,413077,1,B,1,0,Mercury,3,2015,An ice cube is placed in a pan. The pan is placed over an open flame. Which change will most likely happen over time? (A) The ice changes to a liquid and back to a solid. (B) The ice changes to a liquid then to a gas. (C) The ice changes to a gas and back to a solid. (D) The ice changes to a gas then to a liquid.,,Train
Mercury_SC_407369,407369,1,C,1,0,Mercury,5,2015,"Byron is investigating how temperature affects mold growth on bread. Before starting his procedure, Byron states in his journal that he thinks wet bread placed in the refrigerator will grow the most mold. Which term best describes Byron's statement? (A) conclusion (B) result (C) hypothesis (D) variable",,Train
MCAS_1998_4_16,16,1,A,1,0,MCAS,4,1998,The telephone was invented in Boston by (A) Alexander Graham Bell. (B) Samuel F. B. Morse. (C) Henry Ford. (D) Thomas Alva Edison.,,Train
Mercury_416462,416462,1,B,1,0,Mercury,7,2015,Which characteristic can an amoeba change that a paramecium cannot change? (A) sex (B) shape (C) color (D) position,,Train
CSZ_2006_5_CSZ10266,CSZ10266,1,C,1,0,California Standards Test - Science,5,2006,A metal spoon was left in a pot of boiling soup. The cook burned a finger by touching the spoon. Why did the finger get burned? (A) The metal spoon chemically reacted with the cook's hand. (B) The metal spoon conducted electricity to the cook's hand. (C) The metal spoon conducted heat to the cook's hand. (D) The metal spoon insulated the cook's hand.,,Train
Mercury_7213518,7213518,1,B,1,0,Mercury,8,2015,Light rays are focused by the lens of a camera through the process of (A) reflection. (B) refraction. (C) dispersion. (D) diffraction.,,Train
Mercury_184083,184083,1,D,1,0,Mercury,8,2015,Which of these provides the best evidence that the distribution of Earth's oceans has changed over time? (A) hot spots on ocean floors (B) seismic activity along plate boundaries (C) sediment buildup on continental slope (D) marine fossils found on land masses,,Train
Mercury_7024343,7024343,1,C,1,0,Mercury,8,2015,Which change would have the greatest negative impact on the survival of an owl species? (A) an increase in primary consumer population (B) an decrease in acid rain (C) an decrease in size of habitat (D) an increase in producers,,Train
CSZ10086,CSZ10086,1,C,1,0,California Standards Test - Science,5,2005,Which organ removes cell waste from the blood? (A) the large intestine (B) the small intestine (C) the kidney (D) the heart,,Train
Mercury_7011340,7011340,1,B,1,0,Mercury,8,2015,"According to the Big Bang Theory, how is the universe changing? (A) It is contracting. (B) It is expanding. (C) Only the rim is expanding. (D) Only the center is contracting.",,Train
Mercury_SC_400116,400116,1,B,1,0,Mercury,5,2015,Light enters the human eye through the (A) retina. (B) pupil. (C) iris. (D) lens.,,Train
MCAS_2016_5_12,12,1,C,1,0,MCAS,5,2016,The stages in the life cycle of an organism are shown below. birth -> growth -> development -> reproduction -> death In which life cycle stage will a new organism be made? (A) growth (B) development (C) reproduction (D) death,,Train
MCAS_2008_5_5617,5617,1,A,1,0,MCAS,5,2008,Baby chicks peck their way out of their shells when they hatch. This activity is an example of which of the following types of behavior? (A) instinctive (B) learned (C) planned (D) social,,Train
Mercury_7114888,7114888,1,A,1,0,Mercury,7,2015,Which conclusion can be made about earthworms because they do not have an internal skeleton? (A) They are invertebrates. (B) They have radial symmetry. (C) They are made of one segment. (D) They have an open circulatory system.,,Train
Mercury_7083353,7083353,1,B,1,0,Mercury,7,2015,The smallest unit of a plant that can perform all of the processes of life is the (A) leaf. (B) cell. (C) tissue. (D) root.,,Train
Mercury_SC_408685,408685,1,A,1,0,Mercury,5,2015,Soda water is a liquid that has bubbles of carbon dioxide in it. Which term best describes soda water? (A) a mixture (B) a molecule (C) an element (D) a compound,,Train
Mercury_7109550,7109550,1,A,1,0,Mercury,9,2015,"All stars start forming in the same manner. Some follow the life cycle of the Sun, while others turn into neutron stars or black holes. Which property determines the fate of a star as it develops? (A) mass (B) location (C) luminosity (D) temperature",,Train
TIMSS_1995_8_O15,O15,1,B,1,0,TIMSS,8,1995,"If a neutral atom loses an electron, what is formed? (A) A gas (B) An ion (C) An acid (D) A molecule",,Train
Mercury_7033495,7033495,1,C,1,0,Mercury,8,2015,A student mixed baking soda with vinegar and observed that the reaction was endothermic. When is a reaction endothermic? (A) when it is reversible (B) when it can be repeated (C) when it requires heat to make it happen (D) when energy is released by the process,,Train
MCAS_2008_8_5720,5720,1,A,1,0,MCAS,8,2008,"What is the primary energy source that drives all weather events, including precipitation, hurricanes, and tornados? (A) the Sun (B) the Moon (C) Earth's gravity (D) Earth's rotation",,Train
Mercury_SC_406036,406036,1,C,1,0,Mercury,5,2015,Which system absorbs and carries food from the digestive system to the rest of the body? (A) nervous system (B) muscular system (C) circulatory system (D) respiratory system,,Train
Mercury_400613,400613,1,A,1,0,Mercury,6,2015,Why do planets stay in orbit around the Sun? (A) attraction of gravity (B) effect of inertia (C) frictional force (D) rotational force,,Train
MEA_2014_8_9,9,1,B,1,0,MEA,8,2014-2015,"Earth rotates on its north-south axis. Which statement best describes one complete rotation? (A) It takes six months and causes summer and winter seasons. (B) It takes 24 hours and causes night and day. (C) It takes 29 days, which represents one cycle of the Moon's phases. (D) It takes 365 days, which represents one Earth year.",,Train
LEAP_2003_4_10252,10252,1,B,1,0,Louisiana Educational Assessment Program,4,2003,A rock sample will most likely contain (A) plants. (B) minerals. (C) water. (D) wood.,,Train
Mercury_7007385,7007385,1,C,1,0,Mercury,8,2015,A jet plane is moving at a constant velocity on a flat surface. Which forces act against the forward motion of the plane? (A) gravity and engine thrust (B) engine thrust and friction (C) friction and air resistance (D) air resistance and gravity,,Train
Mercury_7217945,7217945,1,C,1,0,Mercury,8,2015,Atmospheric greenhouse gases help heat the atmosphere by (A) increasing the amount of solar radiation reaching Earth. (B) storing energy produced by human activity. (C) absorbing infrared radiation released by Earth. (D) increasing the average density of air.,,Train
NYSEDREGENTS_2009_8_35,35,1,2,1,0,NYSEDREGENTS,8,2009,Scurvy is a disease that sailors often got on long voyages. It was discovered that scurvy could be prevented by eating oranges and lemons. This suggests that scurvy is a disease caused by (1) exposure to sea air (2) a nutritional deficiency (3) a microorganism (4) lack of exercise,,Train
LEAP__5_10313,10313,1,B,1,0,Louisiana Educational Assessment Program,5,?,Runoff from farms that use fertilizers is entering a small lake. This will most directly affect the lake by causing (A) the lake to dry up. (B) algae to grow in the lake. (C) the lake to become deeper. (D) water in the lake to become solid.,,Train
NCEOGA_2013_8_60,60,1,C,1,0,North Carolina READY End-of-Grade Assessment,8,2013,Why is protein an important part of a healthy diet? (A) It is needed to change glucose to energy. (B) It is needed to store nutrients. (C) It is needed to repair tissue. (D) It is needed to produce water.,,Train
Mercury_7009485,7009485,1,B,1,0,Mercury,8,2015,"An atom will always have (A) a single, negatively-charged nucleus. (B) equal numbers of protons and electrons. (C) ""shared"" electrons from another atom. (D) a stable number of charged neutrons.",,Train
Mercury_408134,408134,1,A,1,0,Mercury,6,2015,Students on two different school campuses are comparing the growth rate of grass three weeks after fertilizer has been applied. The same fertilizer and the same amount of water are used on both campuses. Which additional variable is most important to control when the results of the two investigations are compared? (A) type of grass used (B) amount of trees in the area (C) the weather conditions of the day (D) the time of day the measurements are taken,,Train
MCAS_2003_5_5,5,1,D,1,0,MCAS,5,2003,A caterpillar changing into a butterfly is an example of (A) instinct. (B) duplication. (C) reproduction. (D) metamorphosis.,,Train
Mercury_7248518,7248518,1,B,1,0,Mercury,9,2015,"Some immune cells are actively involved in ingesting, destroying, and presenting invading microbial antigens on their surface to stimulate other cells to produce antibodies. Which of these cells is responsible for initiating such an immune response? (A) mast cells (B) phagocytes (C) B-lymphocytes (D) T-lymphocytes",,Train
MCAS_2006_9_18,18,1,D,1,0,MCAS,9,2006,A single prokaryotic cell can divide several times in an hour. Few eukaryotic cells can divide as quickly. Which of the following statements best explains this difference? (A) Eukaryotic cells are smaller than prokaryotic cells. (B) Eukaryotic cells have less DNA than prokaryotic cells. (C) Eukaryotic cells have more cell walls than prokaryotic cells. (D) Eukaryotic cells are more structurally complex than prokaryotic cells.,,Train
Mercury_7248168,7248168,1,B,1,0,Mercury,9,2015,Which biological process determines the probability that particular alleles will be found in any given gamete? (A) mutation (B) meiosis (C) cell cycle (D) protein synthesis,,Train
NYSEDREGENTS_2005_4_24,24,1,C,1,0,NYSEDREGENTS,4,2005,"When a person speaks into a telephone, sound energy is changed mostly into which form of energy? (A) heat (B) light (C) electrical (D) chemical",,Train
Mercury_7029488,7029488,1,D,1,0,Mercury,8,2015,"In the human body, what part of the central nervous system connects with other nerves outside of the central nervous system? (A) dendrite (B) cerebrum (C) cerebellum (D) spinal cord",,Train
Mercury_7283640,7283640,1,C,1,0,Mercury,9,2015,Photovoltaic cells capture photons of sunlight and transform them directly into electricity. Many of Earth's other energy resources are simply transformed solar energy. Which two energy resources store energy that did not begin as solar energy?  (A) oil and coal (B) wind and wood (C) nuclear and geothermal (D) hydropower and natural gas,,Train
Mercury_7210823,7210823,1,B,1,0,Mercury,8,2015,What determines how long the Moon takes to complete one cycle of phases? (A) the period of rotation of the Moon around its axis (B) the period of revolution of the Moon around Earth (C) the period of rotation of Earth around its axis (D) the period of revolution of Earth around the Sun,,Train
Mercury_7014123,7014123,1,D,1,0,Mercury,8,2015,Oxygen reacts with iron to produce rust and with hydrogen to produce water. Which statement describes both reactions? (A) A different mixture is formed in each case. (B) A different solution is formed in each case. (C) Both a change of state and of elements is involved. (D) New molecules are formed but the same elements exist.,,Train
Mercury_183680,183680,1,A,1,0,Mercury,7,2015,What is the primary job of red blood cells? (A) transport oxygen (B) remove waste (C) fight disease (D) allow reproduction,,Train
MCAS_2003_8_20,20,1,A,1,0,MCAS,8,2003,"What kingdom contains organisms that are multicellular, have no chlorophyll, and absorb nutrients from decaying tissue? (A) Fungi (B) Plantae (C) Protista (D) Animalia",,Train
Mercury_7223738,7223738,1,A,1,0,Mercury,8,2015,"A salvage yard contains a mixture of iron, glass, aluminum, and plastic. Which property of iron does the salvage yard take advantage of when separating the iron from the rest of the materials? (A) magnetic (B) electrical (C) ductility (D) malleability",,Train
VASoL_2008_3_24,24,1,B,1,0,Virginia Standards of Learning - Science,3,2008,"While a sailor was out fishing, he got lost at sea. Which object would help him direct the boat back to shore? (A) Rope (B) Magnetic compass (C) Blanket (D) Measuring tape",,Train
Mercury_7205958,7205958,1,C,1,0,Mercury,8,2015,Water is a very important part of the physical weathering of rock. Which of these properties of water is most important in causing some of the physical weathering of rock? (A) Water is a liquid at room temperature. (B) Water can contain different minerals. (C) Water expands when it freezes. (D) Water dissolves many chemicals.,,Train
Mercury_7013440,7013440,1,D,1,0,Mercury,8,2015,A student uses a telescope to view stars at night. The student notices some of the stars are different colors. The color of a star is determined most by its (A) size. (B) distance from Earth. (C) mass. (D) temperature.,,Train
Mercury_7227745,7227745,1,A,1,0,Mercury,9,2015,Which function is performed at similarly structured sites in prokaryotic and eukaryotic cells? (A) protein synthesis (B) packaging and transport of proteins (C) storage of genetic material (D) release of energy from storage forms,,Train
Mercury_SC_413304,413304,1,B,1,0,Mercury,3,2015,Which material is the best natural resource to use for making water-resistant shoes? (A) cotton (B) leather (C) plastic (D) wool,,Train
Mercury_7042613,7042613,1,A,1,0,Mercury,8,2015,"When hunting by humans causes a species to become extinct, this may produce damaging effects throughout the ecosystem of the extinct species. What is the cause of this damage? (A) alteration of a food web (B) degradation of a habitat (C) modification of a climate (D) reversal of a flow of energy",,Train
Mercury_SC_408557,408557,1,D,1,0,Mercury,5,2015,Sarah's class is learning about mixtures and solutions. Her teacher writes four statements on the board. Which statement best describes a mixture? (A) Both substances mix evenly. (B) Both substances can evaporate. (C) One substance dissolves into another. (D) One substance can be separated from the other.,,Train
NAEP_2005_4_S13+13,S13+13,1,B,1,0,NAEP,4,2005,Which of the following best explains why the Sun appears to move across the sky every day? (A) The Sun rotates on its axis. (B) Earth rotates on its axis. (C) The Sun orbits around Earth. (D) Earth orbits around the Sun.,,Train
Mercury_7009695,7009695,1,D,1,0,Mercury,8,2015,The theory of spontaneous generation was eventually disproved scientifically by (A) arguments in philosophy. (B) chemical analysis of material. (C) examining models of the process. (D) conducting a controlled experiment.,,Train
Mercury_7220308,7220308,1,D,1,0,Mercury,8,2015,"Discarded electronic devices, such as outdated computers and cell phones, contain materials that can be toxic to the environment. Which statement best explains why humans continue to use these technologies? (A) Electronics have become less expensive over time. (B) Some areas have recycling programs for electronics. (C) Industries that produce electronics help the economy. (D) Humans value the benefits of these devices over their cost.",,Train
NYSEDREGENTS_2011_4_11,11,1,D,1,0,NYSEDREGENTS,4,2011,A student crumples up a sheet of paper. Which property of the paper has changed? (A) color (B) mass (C) state (D) shape,,Train
Mercury_SC_400403,400403,1,C,1,0,Mercury,5,2015,"When a plant dies, it often decomposes and becomes part of the soil. This process is one step in which cycle? (A) lunar (B) water (C) carbon (D) energy",,Train
ACTAAP_2008_5_3,3,1,D,1,0,ACTAAP,5,2008,Which would best aid a scientist in discovering how Earth may have changed over time? (A) finding the nest of a bald eagle (B) tracking the footprints of a wolf (C) analyzing the pollination of a sunflower (D) discovering a fossil of a seashell in a wooded area,,Train
