questionID,originalQuestionID,totalPossiblePoint,AnswerKey,isMultipleChoiceQuestion,includesDiagram,examName,schoolGrade,year,question,subject,category
Mercury_7094063,7094063,1,D,1,0,Mercury,8,2015,Which of these tectonic plate boundaries is most likely to form a volcano? (A) a continental plate colliding with a continental plate (B) an oceanic plate sliding past a continental plate (C) a continental plate sliding past a continental plate (D) an oceanic plate colliding into a continental plate,,Train
MCAS_2005_8_28,28,1,A,1,0,MCAS,8,2005,Which of the following is an example of heat transfer by conduction? (A) a whole metal spoon getting hot when one end is in hot soup (B) the inside of a car in the sun getting very hot (C) a tar road getting hotter in the sun than a concrete sidewalk (D) a fireplace fire heating a room on a cold day,,Train
Mercury_7098105,7098105,1,D,1,0,Mercury,8,2015,"Alicia gives her brother a push while he is seated on a swing. She finds that after a few seconds, she needs to push again to keep him going. The reason her brother slows down is because the mechanical energy is converted into (A) potential energy that heats the air. (B) chemical energy that moves the swing. (C) kinetic energy which makes the swing slow down. (D) thermal energy that is released into the atmosphere.",,Train
Mercury_SC_401775,401775,1,B,1,0,Mercury,5,2015,An example of a learned behavior is a (A) spider building a web. (B) dog laying down on command. (C) beaver building a dam in a creek. (D) kangaroo jumping away from a predator.,,Train
Mercury_7008733,7008733,1,D,1,0,Mercury,8,2015,An atom consists of a nucleus surrounded by (A) ions. (B) protons. (C) neutrons. (D) electrons.,,Train
Mercury_411034,411034,1,C,1,0,Mercury,8,2015,Which of these causes the atmosphere to change? (A) increased inorganic matter in soil (B) increased use of fertilizers on crops (C) increased buildup of greenhouse gases (D) increased rainfall rates near power plants,,Train
Mercury_7024763,7024763,1,A,1,0,Mercury,8,2015,Which element is most likely to form an ion with a negative 2 charge? (A) oxygen (B) nitrogen (C) beryllium (D) magnesium,,Train
Mercury_7092470,7092470,1,C,1,0,Mercury,8,2015,Mount St. Helens was a cone-shaped mountain that formed when molten material reached the surface of Earth and formed layers. Cone-shaped mountains form as a result of which one of these events? (A) hurricanes (B) earthquakes (C) volcanic eruptions (D) sediment depositions,,Train
Mercury_7043540,7043540,1,B,1,0,Mercury,8,2015,Which process in the water cycle would be accelerated by an increase in temperature? (A) runoff (B) evaporation (C) precipitation (D) condensation,,Train
Mercury_184678,184678,1,B,1,0,Mercury,9,2015,Which of the following foods is highest in polysaccharides? (A) broccoli (B) potatoes (C) cheese (D) fish,,Train
TIMSS_2007_8_pg100,pg100,1,D,1,0,TIMSS,8,2007,"Colored alcohol is used in some glass thermometers. When placed in air of different temperatures, the column of alcohol rises or falls in the glass thermometer. Which of the following best explains why the height of the alcohol column changes? (A) The glass contracts when heated. (B) The alcohol contracts when heated. (C) The glass expands more than the alcohol when heated. (D) The alcohol expands more than the glass when heated.",,Train
Mercury_7071540,7071540,1,D,1,0,Mercury,8,2015,"An organism, such as a nematode worm, may have only 1000 cells. It should be classified as being (A) a virus. (B) a bacteria. (C) unicellular. (D) multicellular.",,Train
Mercury_7009783,7009783,1,C,1,0,Mercury,8,2015,"The Heliocentric Theory, as supported by Copernicus, revolutionized scientific theories regarding (A) the life cycle. (B) the water cycle. (C) the solar system. (D) the immune system.",,Train
NYSEDREGENTS_2006_4_18,18,1,B,1,0,NYSEDREGENTS,4,2006,Which process causes the leaves of a plant to become larger? (A) repair (B) growth (C) decomposition (D) germination,,Train
MDSA_2011_5_43,43,1,C,1,0,Maryland School Assessment - Science,5,2011,Wind changes the surface of Earth. Which of these land formations is a result of transportation and deposition by wind? (A) a delta (B) a glacier (C) a sand dune (D) a mountain peak,,Train
Mercury_7206028,7206028,1,C,1,0,Mercury,8,2015,Water moves by capillary action through soil from moist areas to dry areas. Which property of water is most responsible for this capillary action? (A) Water is a polar molecule. (B) Water contains an oxygen atom. (C) Water has a high surface tension. (D) Water has a high specific heat.,,Train
Mercury_SC_401802,401802,1,D,1,0,Mercury,5,2015,Which action is the best method to separate a mixture of salt and water? (A) using a magnet to extract the salt (B) adding a colored dye to the mixture (C) pouring the mixture through a filter (D) boiling the mixture until the water evaporates,,Train
NYSEDREGENTS_2009_8_28,28,1,1,1,0,NYSEDREGENTS,8,2009,"In humans, a trait can be determined by one pair or many pairs of (1) genes (2) microbes (3) cells (4) organs",,Train
NAEP_2009_4_S7+14,S7+14,1,B,1,0,NAEP,4,2009,Which animal develops inside its mother before it is born alive? (A) Butterfly (B) Cat (C) Duck (D) Frog,,Train
NYSEDREGENTS_2007_8_2,2,1,1,1,0,NYSEDREGENTS,8,2007,Which sequence correctly shows the levels of organization for structure and function in a human? (1) cell -> tissue -> organ -> organ system (2) organ system -> cell -> tissue -> organ (3) tissue -> organ -> organ system -> cell (4) cell -> organ -> tissue -> organ system,,Train
Mercury_SC_401138,401138,1,C,1,0,Mercury,5,2015,Which adaptation allows a fish to get oxygen underwater? (A) fins (B) lungs (C) gills (D) heart,,Train
NYSEDREGENTS_2016_4_14,14,1,A,1,0,NYSEDREGENTS,4,2016,The number of daylight hours in New York State changes with the (A) season of the year (B) Moon's changing appearance (C) direction of the wind (D) arrival of a severe storm,,Train
Mercury_7038535,7038535,1,C,1,0,Mercury,8,2015,Which instrument would be used when studying a unit on amphibian anatomy? (A) a beaker (B) a telescope (C) a dissecting kit (D) a graduated cylinder,,Train
ACTAAP_2008_7_1,1,1,A,1,0,ACTAAP,7,2008,Which is a reason for Arkansas having multiple seasons? (A) the tilt of Earth's axis (B) the speed of Earth's orbit (C) Earth's distance from the Sun (D) Earth gravitational pull toward the Moon,,Train
Mercury_SC_409672,409672,1,D,1,0,Mercury,5,2015,Jessica watches the Sun set in the evening sky. What causes the setting of the Sun? (A) The distance between Earth and the Sun is increasing. (B) The tilt of Earth on its axis is constantly changing. (C) Earth is revolving around the Sun. (D) Earth is rotating on its axis.,,Train
Mercury_414502,414502,1,A,1,0,Mercury,6,2015,To which planet do National Aeronautics and Space Administration (NASA) scientists hope to send humans next? (A) Mars (B) Venus (C) Jupiter (D) Mercury,,Train
NYSEDREGENTS_2011_8_28,28,1,1,1,0,NYSEDREGENTS,8,2011,Which force keeps the planets in their orbits around the Sun? (1) gravity (2) magnetism (3) electricity (4) friction,,Train
Mercury_7189805,7189805,1,D,1,0,Mercury,9,2015,"The endangered Florida manatee is a large, aquatic mammal that feeds on sea grasses in brackish water. Due to where they like to feed, manatees are vulnerable to injuries from boat propellers. If speed zones requiring boats to maintain a low speed are placed in areas where manatees are known to congregate, which will most likely occur? (A) less water pollution in manatee habitats will occur (B) manatees will seek alternate food sources (C) new manatee predators will surface (D) manatee populations will increase",,Train
NCEOGA_2013_5_5,5,1,D,1,0,North Carolina READY End-of-Grade Assessment,5,2013,Which is an example of a different substance being formed? (A) glass breaking (B) metal melting (C) water freezing (D) wood burning,,Train
TIMSS_1995_8_Q14,Q14,1,E,1,0,TIMSS,8,1995,A mixture of powdered iron and sulfur is heated. What will be formed? (A) a single element (B) two other elements (C) a solution (D) an alloy (E) a compound,,Train
Mercury_7085890,7085890,1,A,1,0,Mercury,8,2015,Scientists can identify an element by looking at the structure of a single (A) atom. (B) neutron. (C) molecule. (D) electron.,,Train
Mercury_7242725,7242725,1,B,1,0,Mercury,9,2015,Newly made proteins are modified in which organelle? (A) ribosome (B) endoplasmic reticulum (C) mitochondrion (D) nuclear envelop,,Train
MCAS_2007_8_5165,5165,1,C,1,0,MCAS,8,2007,Which of the following is the primary advantage of sexual reproduction when compared to asexual reproduction? (A) There is a greater number of offspring. (B) There is more food available to offspring. (C) There is greater genetic variety in offspring. (D) There is a longer development time for offspring.,,Train
Mercury_SC_406041,406041,1,B,1,0,Mercury,5,2015,"By attaching to sharks, remora fish eat the scraps of food left behind when the sharks feed. If remoras were not able to attach to sharks, they would most likely (A) attach to boats. (B) not be able to survive. (C) find another source of food. (D) not need to eat anymore.",,Train
Mercury_SC_409901,409901,1,C,1,0,Mercury,5,2015,Plants need a source of energy in order to perform photosynthesis. From which source do plants receive the energy needed to perform photosynthesis? (A) oxygen (B) sugar (C) sunlight (D) water,,Train
Mercury_177433,177433,1,A,1,0,Mercury,8,2015,What form of energy is stored in a battery? (A) chemical (B) sound (C) light (D) heat,,Train
MCAS_2005_5_30,30,1,C,1,0,MCAS,5,2005,"When a light bulb is turned on, energy changes from one form to another. Which of the following best describes this change? (A) sound energy to light energy (B) nuclear energy to light energy (C) electrical energy to light energy (D) magnetic energy to light energy",,Train
Mercury_7252718,7252718,1,C,1,0,Mercury,7,2015,Which stimulus causes a porcupine to extend its quills? (A) lunar effect on Earth (B) seasonal temperature changes (C) threatening behavior by predators (D) environmental encroachment by humans,,Train
MCAS_2004_8_13,13,1,B,1,0,MCAS,8,2004,"When a balloon is filled with air and suddenly released, it will fly around the room as the air escapes. If compared to space transportation, the escaping air is most similar to what subsystem of a spacecraft? (A) guidance (B) propulsion (C) support (D) suspension",,Train
NYSEDREGENTS_2009_8_1,1,1,3,1,0,NYSEDREGENTS,8,2009,The Sun appears larger than other stars because of its (1) yellow color (2) high temperature (3) distance from Earth (4) chemical composition,,Train
NAEP_2000_4_S12+2,S12+2,1,D,1,0,NAEP,4,2000,How hot is it on the surface of the Sun? (A) Not quite as hot as boiling water (B) About as hot as fire (C) About 100°F (D) Much hotter than almost anything on Earth,,Train
NYSEDREGENTS_2011_4_3,3,1,B,1,0,NYSEDREGENTS,4,2011,Which two observations are both used to describe weather? (A) precipitation and runoff (B) temperature and sky conditions (C) wind speed and erosion (D) types of clouds and deposition,,Train
MCAS_2003_8_6,6,1,D,1,0,MCAS,8,2003,A scientist combines oxygen and hydrogen to form water. This combination illustrates that water is (A) an atom. (B) an element. (C) a mixture. (D) a compound.,,Train
LEAP__7_10336,10336,1,A,1,0,Louisiana Educational Assessment Program,7,?,"In a large forest with many animals, there are only a small number of bears. Which of these most likely limits the population of bears in the forest? (A) supply of food (B) type of tree (C) predation by carnivores (D) amount of suitable shelter",,Train
NAEP_2000_4_S21+7,S21+7,1,A,1,0,NAEP,4,2000,There is a thunderstorm close to your house. The windows rattle at the same time that you hear the thunder. What causes the windows to rattle? (A) Sound waves from the thunder (B) Light from the lightning (C) Rain from the clouds (D) The high humidity during the storm,,Train
Mercury_7173863,7173863,1,C,1,0,Mercury,8,2015,Rocks in warm and humid environments can be weathered faster than rocks in other environments. Which is most likely the next step in the rock cycle for weathered rocks? (A) They are cemented. (B) They are compacted. (C) They become eroded. (D) They become molted.,,Train
Mercury_7099680,7099680,1,B,1,0,Mercury,8,2015,"If the solar system were used as a model of an atom, what would the Sun most likely represent? (A) an ion (B) a nucleus (C) a neutron (D) an electron",,Train
OHAT_2010_5_14,14,1,B,1,0,Ohio Achievement Tests,5,2010,A student provides the following directions for brushing teeth: • Turn on the water. • Fill the glass with water and leave the water running. • Put toothpaste on the toothbrush. • Brush for two minutes. • Rinse mouth with the water from the glass. • Rinse the toothbrush with the running water. • Turn off the water. Which change in these directions would conserve the most water? (A) Brush for three minutes. (B) Turn the water off before brushing. (C) Rinse mouth with the running water. (D) Use less toothpaste on the toothbrush.,,Train
Mercury_7245455,7245455,1,D,1,0,Mercury,9,2015,Which of these shows the correct order for the central dogma of molecular biology? (A) DNA to protein to RNA (B) RNA to DNA to protein (C) protein to DNA to RNA (D) DNA to RNA to protein,,Train
Mercury_7283238,7283238,1,C,1,0,Mercury,9,2015,Meiosis contributes to the process of reproduction by producing what type of cell? (A) aneuploid (B) diploid (C) haploid (D) polyploid,,Train
Mercury_7085400,7085400,1,B,1,0,Mercury,7,2015,The abundance of a mineral at the surface of Earth most likely depends upon the (A) climate of a particular region. (B) types of elements available in the crust. (C) thicknesses of nearby rock layers. (D) exposure of the elements to the environment.,,Train
Mercury_7064348,7064348,1,D,1,0,Mercury,7,2015,Which has the greatest effect on aiding the movement of blood through the human body? (A) tension (B) friction (C) density (D) gravity,,Train
Mercury_SC_400161,400161,1,C,1,0,Mercury,5,2015,Why should scientists wear goggles during experiments? (A) to block out bright sunlight (B) to magnify small objects (C) to protect their eyes (D) to see in the dark,,Train
MCAS_2008_8_5712,5712,1,D,1,0,MCAS,8,2008,Which of the following organisms produces energy from sunlight? (A) worm (B) rabbit (C) hawk (D) grass,,Train
TIMSS_2003_4_pg86,pg86,1,D,1,0,TIMSS,4,2003,Which statement is true for all objects? (A) All objects are shiny. (B) All objects are hard. (C) All objects are rough. (D) All objects have mass.,,Train
Mercury_7012548,7012548,1,C,1,0,Mercury,8,2015,Elements in the same column of the Periodic Table of the Elements all (A) have the same number of protons. (B) share the same atomic structure. (C) have similar physical characteristics. (D) share the same number of neutrons.,,Train
NYSEDREGENTS_2005_4_3,3,1,A,1,0,NYSEDREGENTS,4,2005,What is the main function of scales on a fish? (A) to protect the fish (B) to attract predators (C) to help the fish find food (D) to help the fish breathe,,Train
Mercury_175980,175980,1,A,1,0,Mercury,8,2015,Which invention made mass production possible? (A) the assembly line (B) the airplane (C) the personal computer (D) the telephone,,Train
Mercury_7123148,7123148,1,C,1,0,Mercury,8,2015,What causes a meteoroid to glow as it falls through the atmosphere of Earth? (A) wind (B) gravity (C) friction (D) sunlight,,Train
Mercury_7109445,7109445,1,B,1,0,Mercury,9,2015,The cheetah population around the world has decreased because of poaching and loss of habitat. The surviving population is found to have similar alleles. Which factor is endangering the species' survival the most? (A) harmful genetic mutations (B) shrinking of the gene pool (C) decrease in competition (D) increase in adaptations,,Train
Mercury_7016433,7016433,1,A,1,0,Mercury,8,2015,What is generated when the students count and record the number of organisms in the pond water? (A) data (B) variables (C) a hypothesis (D) a conclusion,,Train
Mercury_7093345,7093345,1,B,1,0,Mercury,8,2015,The Mariana Trench is the deepest ocean trench on Earth. This trench occurs at a plate boundary where (A) one plate is sliding past another. (B) one plate is being forced beneath another. (C) two plates are colliding into each other. (D) two plates are pulling apart from each other.,,Train
AKDE&ED_2008_4_30,30,1,C,1,0,Alaska Dept. of Education & Early Development,4,2008,Students want to find out at which temperature bean plants grow tallest. Which science process skill would be used to find this temperature? (A) inferring (B) predicting (C) measuring (D) classifying,,Train
Mercury_7007945,7007945,1,C,1,0,Mercury,8,2015,When would the highest tides occur along the Texas coast? (A) at sunrise (B) at sunset (C) during a full moon (D) during a half moon,,Train
Mercury_7003938,7003938,1,C,1,0,Mercury,8,2015,"Sodium (Na) and chlorine (Cl) combine to form sodium chloride (NaCl), which is commonly known as (A) soap. (B) vinegar. (C) table salt. (D) baking soda.",,Train
NYSEDREGENTS_2011_4_5,5,1,A,1,0,NYSEDREGENTS,4,2011,"It rained on a hot summer afternoon and a puddle formed. After several hours, the puddle was gone. Which two processes made the puddle form and then disappear? (A) precipitation followed by evaporation (B) deposition followed by evaporation (C) precipitation followed by runoff (D) deposition followed by runoff",,Train
MCAS_2000_4_2,2,1,B,1,0,MCAS,4,2000,Which environmental problem was directly caused by the invention of the automobile? (A) storage of nuclear waste (B) increase in air pollution (C) increased use of pesticides (D) flooding in the Midwest,,Train
Mercury_SC_408584,408584,1,B,1,0,Mercury,5,2015,"At some places in Florida, sand on the beaches is being reduced. New sand is brought from other areas and spread on the beaches. What process causes this reduction to the beach sand? (A) earthquakes (B) erosion (C) landslides (D) weathering",,Train
Mercury_416644,416644,1,C,1,0,Mercury,7,2015,Which characteristic of a volvox colony makes it more like a multicellular organism than a simple cluster of unicellular organisms? (A) The cells in the colony respond to stimuli separately. (B) The cells in the colony are arranged in a specific shape. (C) Some cells in the colony are specialized for reproduction. (D) Cells in the colony are connected by strands of cytoplasm.,,Train
MSA_2013_8_44,44,1,A,1,0,MSA,8,2013,"Students are investigating which type of fruit attracts the most fruit flies. Equally sized pieces of ripe apple, peach, and banana are placed in separate containers. The containers allow fruit flies to enter, but the fruit flies are unable to escape. The containers are placed outside on a picnic table for two days. The most reliable method for collecting data is to count the number of fruit flies (A) on all three types of fruit every two hours (B) on all three types of fruit after each fruit spoils (C) on the banana on Day 1, the apple on Day 2, and the peach on Day 3 (D) on the banana after Hour 1, the apple after Hour 2, and the peach after Hour 3",,Train
NCEOGA_2013_8_52,52,1,D,1,0,North Carolina READY End-of-Grade Assessment,8,2013,Malaria is a common disease in many countries. What is the cause of this disease? (A) a virus (B) a bacterium (C) a fungus (D) a parasite,,Train
VASoL_2010_3_1,1,1,A,1,0,Virginia Standards of Learning - Science,3,2010,"Mold is often found growing on old bread. In a food chain, mold is a ___. (A) decomposer (B) producer (C) consumer (D) scavenger",,Train
NYSEDREGENTS_2011_8_41,41,1,3,1,0,NYSEDREGENTS,8,2011,Which form of energy are x rays and ultraviolet light? (1) nuclear (2) heat (3) electromagnetic (4) chemical,,Train
Mercury_7213185,7213185,1,C,1,0,Mercury,8,2015,Which of these geographic features most directly influences the climate of Nevada by limiting the amount of water vapor that can reach the state and fall as rain? (A) Pacific Ocean (B) Colorado River (C) Sierra Nevada Mountains (D) Columbia River Basin,,Train
Mercury_7250040,7250040,1,D,1,0,Mercury,9,2015,"Cells come in two basic types, prokaryotic and eukaryotic. Which cell structure is found in both prokaryotic and eukaryotic cells? (A) vacuole (B) nucleoid (C) mitochondrion (D) cytoplasm",,Train
OHAT_2008_5_31,31,1,A,1,0,Ohio Achievement Tests,5,2008,From which part of the plant does a bee get food? (A) flower (B) seed (C) stem (D) root,,Train
Mercury_7150378,7150378,1,C,1,0,Mercury,9,2015,"As Earth revolves around the Sun, the number of daylight hours varies from place to place. In which location would the number of daylight hours remain constant? (A) North Pole (B) Prime Meridian (C) Equator (D) Antarctica",,Train
Mercury_SC_401171,401171,1,C,1,0,Mercury,5,2015,Why does tapping a fork against a water glass produce a sound? (A) The air expands. (B) The fork releases electrons. (C) The particles in the objects vibrate. (D) The water in the glass forms ripples.,,Train
MCAS_2007_5_4794,4794,1,C,1,0,MCAS,5,2007,A student places a sheet of black construction paper on her desk. What happens to most of the light that strikes the black construction paper? (A) The light is bent by the paper. (B) The light reflects off the paper. (C) The light is absorbed by the paper. (D) The light passes through the paper.,,Train
TIMSS_2007_4_pg43,pg43,1,B,1,0,TIMSS,4,2007,"Which of these groups animals are ALL mammals? (A) duck, eagle, parrot (B) mouse, monkey, bat (C) butterfly, ant, mosquito (D) crocodile, snake, turtle",,Train
VASoL_2008_5_30,30,1,B,1,0,Virginia Standards of Learning - Science,5,2008,Which part of a plant cell is responsible for controlling the activities of the other parts of the cell? (A) Vacuole (B) Nucleus (C) Cell wall (D) Chloroplast,,Train
Mercury_7144148,7144148,1,B,1,0,Mercury,9,2015,All metabolic functions fall into one of two categories: a breaking down process (catabolic) or a building up process (anabolic). Which is an example of an anabolic process? (A) respiration (B) protein synthesis (C) oxygen transport (D) carbohydrate digestion,,Train
Mercury_7189368,7189368,1,C,1,0,Mercury,9,2015,Clearing forests of trees and vegetation for human development can have major impacts on the ecosystem. Which would most likely occur after a forested area is cleared? (A) an increase in habitat for wildlife (B) a decrease in food competition (C) an increase in soil erosion (D) a decrease in water runoff,,Train
VASoL_2010_5_25,25,1,B,1,0,Virginia Standards of Learning - Science,5,2010,Which of these is the most responsible for the changes of the seasons on Earth? (A) Position of the Moon (B) Tilt of Earth on its axis (C) Temperature of the Sun (D) Distance to Mars,,Train
Mercury_405168,405168,1,A,1,0,Mercury,6,2015,Turning off the light when leaving a room is an example of (A) conserving energy. (B) wasting energy. (C) using potential energy. (D) using chemical energy.,,Train
MCAS_2000_8_1,1,1,A,1,0,MCAS,8,2000,"Which list contains only things that are part of our solar system? (A) planets, moons, comets (B) galaxies, quasars, asteroids (C) black holes, novas, stars (D) clusters, asteroids, meteors",,Train
Mercury_405946,405946,1,B,1,0,Mercury,6,2015,A family installs a new heating system in their home. Which is the most desirable result of the new heating system? (A) producing more noise pollution (B) decreasing the amount of energy used (C) increasing the use of natural resources (D) increasing the time it takes to heat the home,,Train
Mercury_7164868,7164868,1,B,1,0,Mercury,8,2015,The Andes Mountains in South America formed when an oceanic plate shifted beneath a continental plate. Which other landforms are usually associated with this type of plate boundary? (A) barrier islands (B) ocean trenches (C) mid-ocean ridges (D) volcanic island arcs,,Train
MCAS_2005_5_7,7,1,B,1,0,MCAS,5,2005,Which of the following animals goes through metamorphosis? (A) alligator (B) frog (C) lizard (D) turtle,,Train
Mercury_7041038,7041038,1,B,1,0,Mercury,8,2015,Which group of organisms can make food by a process called chemosynthesis? (A) scavengers (B) producers (C) consumers (D) decomposers,,Train
Mercury_7018043,7018043,1,D,1,0,Mercury,8,2015,"Which of these are broken down during chemical, but not physical, changes? (A) elements (B) mixtures (C) solutions (D) compounds",,Train
MDSA_2007_4_37,37,1,A,1,0,Maryland School Assessment - Science,4,2007,Fossils of clam shells were found in the Appalachian Mountains. Which of these statements best explains why the clam shells were found in the Appalachian Mountains? (A) The mountain range was once under water. (B) Birds flying overhead dropped the clam shells. (C) Animals released the clam shells in their waste. (D) The clams lived on land before moving to water.,,Train
Mercury_7212450,7212450,1,B,1,0,Mercury,8,2015,"When a formula unit of magnesium sulfide, MgS, is separated into magnesium and sulfur particles, the particles are called (A) molecules. (B) ions. (C) isotopes. (D) compounds.",,Train
Mercury_7037695,7037695,1,C,1,0,Mercury,8,2015,Which action is an example of an exothermic process? (A) baking bread (B) cooking an egg (C) making ice cubes (D) evaporation of water,,Train
Mercury_SC_402055,402055,1,D,1,0,Mercury,5,2015,Which best explains why some reptiles and amphibians lay an abundance of eggs? (A) It increases the population. (B) The eggs provide food for predators. (C) These animals do not have to stay with their eggs. (D) It increases the chance of some eggs surviving to hatch.,,Train
Mercury_SC_401772,401772,1,D,1,0,Mercury,5,2015,Which is the best example of recycling? (A) using low energy appliances (B) washing and reusing plastic cups (C) using empty milk cartons as flower planters (D) using aluminum cans to make new products,,Train
Mercury_SC_401332,401332,1,C,1,0,Mercury,5,2015,"When two objects are touching, heat is transferred from the warmer object to the cooler one by (A) radiation. (B) convection. (C) conduction. (D) insulation.",,Train
