questionID,originalQuestionID,totalPossiblePoint,AnswerKey,isMultipleChoiceQuestion,includesDiagram,examName,schoolGrade,year,question,subject,category
Mercury_7220990,7220990,1,B,1,0,Mercury,8,2015,Which factor will most likely cause a person to develop a fever?  (A) a leg muscle relaxing after exercise (B) a bacterial population in the bloodstream (C) several viral particles on the skin (D) carbohydrates being digested in the stomach,,Train
MCAS_2007_8_5189,5189,1,B,1,0,MCAS,8,2007,Lichens are symbiotic organisms made of green algae and fungi. What do the green algae supply to the fungi in this symbiotic relationship? (A) carbon dioxide (B) food (C) protection (D) water,,Train
Mercury_SC_401169,401169,1,D,1,0,Mercury,5,2015,"When a switch is used in an electrical circuit, the switch can (A) cause the charge to build. (B) increase and decrease the voltage. (C) cause the current to change direction. (D) stop and start the flow of current.",,Train
MCAS_2004_8_27,27,1,A,1,0,MCAS,8,2004,Which of the following is an example of an assistive device? (A) contact lens (B) motorcycle (C) raincoat (D) coffee pot,,Train
NYSEDREGENTS_2006_8_10,10,1,3,1,0,NYSEDREGENTS,8,2006,"Rocks are classified as igneous, metamorphic, or sedimentary according to (1) their color (2) their shape (3) how they formed (4) the minerals they contain",,Train
Mercury_7013388,7013388,1,C,1,0,Mercury,8,2015,A chewable calcium carbonate tablet is a common treatment for stomach discomfort. Calcium carbonate is most likely used as this type of medicine because calcium carbonate (A) has a pleasant flavor. (B) is inexpensive to produce. (C) neutralizes digestive acid. (D) occurs naturally in the body.,,Train
Mercury_7179953,7179953,1,A,1,0,Mercury,7,2015,Which two body systems are directly involved in movement? (A) muscular and skeletal (B) digestive and muscular (C) skeletal and respiratory (D) respiratory and digestive,,Train
Mercury_7205118,7205118,1,C,1,0,Mercury,8,2015,Which change in the state of water particles causes the particles to become arranged in a fixed position? (A) boiling (B) melting (C) freezing (D) evaporating,,Train
MCAS_2016_8_13,13,1,B,1,0,MCAS,8,2016,Earth's core is primarily composed of which of the following materials? (A) basalt (B) iron (C) magma (D) quartz,,Train
Mercury_7283255,7283255,1,C,1,0,Mercury,9,2015,Which of the following events during meiosis contributes most to the variation within a species? (A) pairing of chromosomes (B) creation of haploid gametes (C) segregation of alleles (D) separation of chromatids,,Train
MCAS_2005_5_29,29,1,A,1,0,MCAS,5,2005,"Which of the following was probably most important in the formation of dark, fertile soil that is good for farming? (A) plant decomposition (B) radioactive decay (C) water erosion (D) wind erosion",,Train
MCAS_2001_8_7,7,1,A,1,0,MCAS,8,2001,"When igneous rock is changed into metamorphic rock, which form of energy is this process? (A) heat (B) chemical (C) magnetic (D) light",,Train
Mercury_SC_400329,400329,1,B,1,0,Mercury,5,2015,"In humans, the digestion process begins in (A) the intestine, with squeezing. (B) the mouth, with chewing and saliva. (C) the stomach, with churning and acid. (D) the esophagus, with pushing towards the stomach.",,Train
Mercury_SC_407440,407440,1,B,1,0,Mercury,4,2015,Which of these items contains only a solution? (A) a jar of pickles (B) a bottle of juice (C) a bag of peanuts (D) a can of mixed fruit,,Train
MCAS_2016_8_7,7,1,A,1,0,MCAS,8,2016,"Many natural rock formations change color over time. In Utah, for example, iron oxidized and formed red, orange, and yellow rock. Which of the following is the cause of this change? (A) chemical weathering (B) mechanical weathering (C) water erosion (D) wind erosion",,Train
MEA_2016_8_8,8,1,A,1,0,MEA,8,2016,"A population of small, plant-eating beetles lives in a forest. About half of the beetles are light brown and the others are dark green. If years of drought cause the area to become dry with few trees, what would the beetle population most likely look like after several generations? (A) It would be mostly light brown beetles. (B) It would be mostly dark green beetles. (C) It would be mostly carnivorous beetles. (D) It would be mostly very large beetles.",,Train
Mercury_SC_400124,400124,1,D,1,0,Mercury,5,2015,A scientist wanting to document a change in a river's flow pattern should observe a river over a period of (A) days. (B) weeks. (C) months. (D) years.,,Train
Mercury_405944,405944,1,A,1,0,Mercury,6,2015,Automobile engines built today are designed to be gas efficient. Gas-efficient engines most likely affect a city by reducing (A) air pollution. (B) heat pollution. (C) noise pollution. (D) light pollution.,,Train
Mercury_SC_405129,405129,1,B,1,0,Mercury,5,2015,"A student in an empty classroom shouts, ""Hello!"" Which best explains what the student hears after the shout? (A) an increased loudness of sound (B) a reflection of sound (C) an increased frequency of sound (D) a refraction of sound",,Train
NYSEDREGENTS_2011_8_4,4,1,1,1,0,NYSEDREGENTS,8,2011,Which type of energy in gasoline is transformed into mechanical energy in a motorcycle engine? (1) chemical (2) nuclear (3) magnetic (4) electrical,,Train
Mercury_SC_406063,406063,1,C,1,0,Mercury,5,2015,A student standing near a campfire feels warmer as the fire grows. Which process most likely transfers heat from the campfire to the student? (A) conduction (B) convection (C) radiation (D) transformation,,Train
Mercury_412056,412056,1,B,1,0,Mercury,8,2015,"In snapdragon plants, red flowers are dominant to white flowers. When red-flowered plants are crossed with white-flowered plants, pink flowers are produced. If a researcher wants to produce plants with only white flowers, what color should the parent plants be? (A) both red (B) both white (C) one red and one white (D) one white and one pink",,Train
Mercury_7016590,7016590,1,B,1,0,Mercury,8,2015,"Scientists use the term ""light year"" to describe (A) how fast light travels in space. (B) the distance light travels in one year. (C) how large the diameters of different stars are. (D) the time it takes the Sun to move through the galaxy.",,Train
Mercury_7148628,7148628,1,D,1,0,Mercury,9,2015,Plate movement can form different features on Earth. The movement of tectonic plates can be both a constructive and a destructive force. At which type of plate boundary is new crust formed? (A) convergent (B) subduction (C) transform (D) divergent,,Train
NYSEDREGENTS_2007_8_7,7,1,1,1,0,NYSEDREGENTS,8,2007,Which group of organisms can show significant trait changes in the shortest period of time? (1) bacteria (2) birds (3) fish (4) reptiles,,Train
CSZ10336,CSZ10336,1,A,1,0,California Standards Test - Science,5,2007,Peach trees have sweet-smelling blossoms and produce rich fruit. What is the main purpose of the flowers of a peach tree? (A) to attract bees for pollination (B) to create flower arrangements (C) to protect the tree from disease (D) to feed migratory birds,,Train
Mercury_7109393,7109393,1,A,1,0,Mercury,9,2015,A group of students are researching changes in climate in their region. Which of these would best provide evidence of changes in temperature and rainfall over a period of years? (A) tree rings (B) pollen samples (C) harvest production (D) carbon dating,,Train
Mercury_SC_LBS10953,LBS10953,1,D,1,0,Mercury,4,2015,"Which of these would help to prevent infections from occurring in small cuts and scrapes? (A) apply a cold ice pack (B) raise the injured area (C) apply pressure to stop bleeding (D) wash the area with warm, soapy water",,Train
NCEOGA_2013_5_8,8,1,A,1,0,North Carolina READY End-of-Grade Assessment,5,2013,Which best describes why winds at the beach change direction between day and night? (A) because the temperatures over land and over water change (B) because warm air over land sinks and stays in place over land (C) because cool air rises and is replaced by warm air from the ocean (D) because cool air sinks and stays in place over land,,Train
Mercury_7017763,7017763,1,B,1,0,Mercury,8,2015,Soil erosion can be best prevented by (A) removing grass from the steepest slope. (B) building terraces into the sides of a slope. (C) heavily watering the vegetation on the slope. (D) increasing the slope of the land by adding more soil.,,Train
MCAS_1999_4_29,29,1,A,1,0,MCAS,4,1999,Which of the following properties provides the BEST way to identify a mineral? (A) hardness (B) shape (C) size (D) temperature,,Train
NYSEDREGENTS_2011_8_20,20,1,1,1,0,NYSEDREGENTS,8,2011,Which sequence represents the order of development for many plants? (1) seed develops inside fruit -> seed is dispersed -> seed germinates -> plant grows (2) seed is dispersed -> seed develops inside fruit -> seed germinates -> plant grows (3) seed germinates -> plant grows -> seed is dispersed -> seed develops inside fruit (4) seed is dispersed -> plant grows -> seed germinates -> seed develops inside fruit,,Train
VASoL_2009_5_4,4,1,C,1,0,Virginia Standards of Learning - Science,5,2009,"When ice cream is left out of a freezer, the ice cream changes from a ___. (A) solid to a gas (B) gas to a liquid (C) solid to a liquid (D) liquid to a gas",,Train
NYSEDREGENTS_2005_8_9,9,1,1,1,0,NYSEDREGENTS,8,2005,Which equipment will best separate a mixture of iron filings and black pepper? (1) magnet (2) filter paper (3) triple-beam balance (4) voltmeter,,Train
NAEP_2011_8_S11+3,S11+3,1,A,1,0,NAEP,8,2011,Which characteristic is shared by all cells? (A) They need energy. (B) They reproduce sexually. (C) They make their own food. (D) They move from place to place.,,Train
Mercury_7018305,7018305,1,B,1,0,Mercury,8,2015,"On a small, isolated island, a hurricane destroyed all the trees that produced a large, hard-shelled nut. Which bird population would most likely decrease? (A) birds with long, probing beaks (B) birds with thick, strong beaks (C) birds with thin, short beaks (D) birds with large, pouch beaks",,Train
Mercury_7145250,7145250,1,B,1,0,Mercury,9,2015,"A cow and a frog have similar bone structures in their forelimbs. Both have phalanges, radius, ulna, and humerus bones. However, the cow and frog are animals with very different life cycles from each other. Which most likely describes why the body structures of these animals are so similar? (A) Both have undergone similar mutations. (B) Both descended from a common ancestor. (C) Both reacted similarly to environmental pressures. (D) Both spread out from the same geographical region.",,Train
Mercury_7220903,7220903,1,A,1,0,Mercury,8,2015,A cell that is unable to import substances required to process chemical energy is most likely a result of a malfunctioning (A) cell membrane. (B) endoplasmic reticulum. (C) Golgi body. (D) nuclear envelope.,,Train
Mercury_SC_416457,416457,1,D,1,0,Mercury,5,2015,Which best describes all unicellular organisms? (A) Every cell is round. (B) Every cell can make food. (C) Every cell can move on its own. (D) Every cell performs all life functions.,,Train
Mercury_7015313,7015313,1,D,1,0,Mercury,8,2015,"When a transverse wave passes from right to left through a medium, what happens to the particles of the medium? (A) Particles travel from right to left along the wave. (B) Particles travel from left to right along the wave. (C) Particles move back and forth parallel to the wave. (D) Particles move back and forth perpendicular to the wave.",,Train
Mercury_7001663,7001663,1,D,1,0,Mercury,8,2015,Which characteristic below most likely accounts for our limited knowledge of galaxies? (A) their tiny size (B) their magnetic cores (C) their inability to produce light (D) their great distance from Earth,,Train
Mercury_7172778,7172778,1,B,1,0,Mercury,7,2015,Decomposers increase the fertility of the soil and prevent dead organisms from building up in the environment. In which way do decomposers make the soil more fertile? (A) by adding carbon (B) by adding nitrogen (C) by removing excess water (D) by removing excess minerals,,Train
Mercury_7024168,7024168,1,A,1,0,Mercury,8,2015,"When oxygen combines with hydrogen, which substance is formed? (A) water (B) vinegar (C) hydrochloric acid (D) hydrogen dioxide",,Train
Mercury_7150360,7150360,1,A,1,0,Mercury,9,2015,"When plants undergo photosynthesis, a reaction produces sugar, oxygen, and water. During respiration, stored energy from the products of photosynthesis is converted to usable energy. In what form is the energy stored prior to use in respiration? (A) chemical energy (B) kinetic energy (C) light energy (D) heat energy",,Train
Mercury_7071558,7071558,1,B,1,0,Mercury,8,2015,Which of the following is a typical example of a unicellular organism? (A) earthworm (B) bacteria (C) fungi (D) green algae,,Train
Mercury_7245403,7245403,1,D,1,0,Mercury,9,2015,"Over geologic time, global mean sea level has varied significantly. Which change is most likely responsible for an increase in global mean sea level? (A) erosion of sediment from a mountain range (B) mass extinction of marine organisms (C) formation of an ocean trench (D) melting of polar ice caps",,Train
Mercury_SC_401822,401822,1,D,1,0,Mercury,5,2015,Which body system is most responsible for the removal of waste? (A) skeletal system (B) nervous system (C) muscular system (D) excretory system,,Train
OHAT_2007_8_23,23,1,C,1,0,Ohio Achievement Tests,8,2007,In which environment is white fur color an advantage for survival? (A) desert (B) grassland (C) arctic tundra (D) temperate forest,,Train
Mercury_7212380,7212380,1,C,1,0,Mercury,8,2015,Which of these will best separate iron filings from sand? (A) water (B) a magnifying glass (C) a magnet (D) rubbing alcohol,,Train
Mercury_414132,414132,1,B,1,0,Mercury,6,2015,Which of these is the chemical symbol for magnesium? (A) Ma (B) Mg (C) Mn (D) Mu,,Train
Mercury_7121800,7121800,1,A,1,0,Mercury,7,2015,Which of the following is most likely to lead to error in an experiment? (A) bias (B) repeated trials (C) peer review (D) use of a control,,Train
MCAS_2001_8_2,2,1,A,1,0,MCAS,8,2001,Which best describes transportation technology? (A) a system that is used to move people and products (B) an enterprise that changes raw materials into goods (C) the building and finishing of structures (D) the conversion of mechanical energy into heat energy,,Train
Mercury_7121765,7121765,1,D,1,0,Mercury,7,2015,"In a gasoline-powered car, chemical energy from gasoline is transformed to make the car move. The motion of the car is what form of energy? (A) radiant energy (B) nuclear energy (C) electrical energy (D) mechanical energy",,Train
Mercury_7011165,7011165,1,A,1,0,Mercury,8,2015,Which characteristic is affected by interactions with the environment? (A) weight (B) eye color (C) blood type (D) handedness,,Train
Mercury_7033793,7033793,1,C,1,0,Mercury,8,2015,Which is the greatest impact humans have had on the carbon cycle? (A) clear-cutting forests (B) manufacturing plastics (C) burning fossil fuels (D) growing agricultural crops,,Train
Mercury_SC_400301,400301,1,D,1,0,Mercury,5,2015,The floating arrow on a compass always points towards the (A) west. (B) east. (C) south. (D) north.,,Train
NYSEDREGENTS_2016_4_21,21,1,D,1,0,NYSEDREGENTS,4,2016,"Which color shirt will reflect the most light on a hot, sunny day? (A) black (B) blue (C) red (D) white",,Train
MCAS_2005_9_13,13,1,D,1,0,MCAS,9,2005,"A 10 g sample of aluminum and a 10 g sample of iron were each heated by 100 joules of energy. The temperature of the aluminum sample rose 11°C, while the temperature of the iron sample increased 23°C. Which statement best accounts for these results? (A) Iron is twice as dense as aluminum. (B) Atoms of aluminum are smaller than atoms of iron. (C) Using equal masses results in similar heat capacities. (D) The specific heat of iron is less than that of aluminum.",,Train
MCAS_1999_4_31,31,1,B,1,0,MCAS,4,1999,"If its food supply in a field decreases, the mouse population in that field will probably (A) increase. (B) decrease. (C) remain the same. (D) become extinct.",,Train
Mercury_7234413,7234413,1,C,1,0,Mercury,9,2015,Overuse of soil for farming causes local disruptions of several Earth subsystems. Which of these is a part of the biogeochemical cycle that experiences the most severe local disruption? (A) release of carbon into the atmosphere (B) release of oxygen into the atmosphere (C) cycling phosphorus into the soil (D) cycling hydrogen into the soil,,Train
MCAS_2007_8_5167,5167,1,D,1,0,MCAS,8,2007,Which of the following is an example of a physical change but not a chemical change? (A) A log gives off heat and light as it burns. (B) A tree stores energy from the Sun in its fruit. (C) A penny lost in the grass slowly changes color. (D) A water pipe freezes and cracks on a cold night.,,Train
Mercury_7080938,7080938,1,C,1,0,Mercury,8,2015,"While conducting an investigation on refraction, a teacher uses a red laser pointer to show how a beam of light is affected as it passes through several glass objects. The teacher should make sure that the (A) room is totally dark. (B) light source is ultraviolet. (C) beam of light does not travel toward the students. (D) room walls are shielded with insulating material.",,Train
Mercury_SC_408443,408443,1,A,1,0,Mercury,4,2015,One student wrote a report about an investigation in which fertilizer was added to tomato plants. Which information from that student's report would most help a second student repeat the investigation? (A) the amount of fertilizer added (B) the height of the fertilized plants (C) the size of each tomato produced (D) the number of tomatoes produced,,Train
VASoL_2007_3_5,5,1,B,1,0,Virginia Standards of Learning - Science,3,2007,A student wants to look under a heavy rock. Which simple machine would be BEST to use to lift the rock? (A) Wheel and axle (B) Lever (C) Inclined plane (D) Screw,,Train
Mercury_403680,403680,1,B,1,0,Mercury,7,2015,Rust is a compound with the formula Fe_{2}O_{3}. Which elements combine to form rust? (A) iron and water (B) iron and oxygen (C) iron and air (D) iron and acid,,Train
Mercury_400223,400223,1,B,1,0,Mercury,8,2015,The chemical equation below shows a reaction of copper (Cu) with silver nitrate (AgNO_{3}) yielding silver (Ag) and copper(II) nitrate (Cu(NO_{3})_{2}) Cu + 2AgNO_{3} -> 2Ag + Cu(NO_{3})_{2} Silver and copper(II) nitrate are called the (A) reactants. (B) products. (C) catalysts. (D) inhibitors.,,Train
Mercury_184625,184625,1,D,1,0,Mercury,9,2015,What role does the centromere play in cellular reproduction? (A) It is the area where microtubules are formed. (B) It is the area where the nucleus is during cell division. (C) It is the area of alignment for the chromosomes. (D) It is the area of attachment for chromatids.,,Train
MCAS_2005_8_14,14,1,B,1,0,MCAS,8,2005,"If 1 kg of the compound toluene melts at -95°C, then 500 g of toluene will (A) melt at -47.5°C. (B) melt at -95°C. (C) boil at 95°C. (D) boil at 47.5°C.",,Train
Mercury_409478,409478,1,C,1,0,Mercury,8,2015,"A calculation based on the chemical energy of gasoline shows that a car should be able to go 100 miles on a gallon of fuel. When the car was driven on a test track, the car only went 25 miles on a gallon of fuel. What accounts for most of the difference? (A) the mass of the driver and the fuel carried by the car (B) the wind resistance between the car and the air nearby (C) the waste heat from the combustion of fuel in the engine (D) the friction between the tires and the surface of the track",,Train
Mercury_7038325,7038325,1,B,1,0,Mercury,8,2015,A student wants to find the relationship between the diameter of several plastic disks and the circumference of each disk. Which of these types of graphs should be constructed to determine this relationship? (A) pie graph (B) line graph (C) scatterplot (D) box-and-whisker plot,,Train
Mercury_SC_402624,402624,1,A,1,0,Mercury,5,2015,"When light is bounced off a mirror, the light is (A) reflected. (B) refracted. (C) absorbed. (D) diffracted.",,Train
Mercury_185430,185430,1,C,1,0,Mercury,8,2015,Which of the following sentences best explains what happens when puddles evaporate?  (A) The water absorbs into the ground. (B) The particles of matter move more slowly. (C) The water changes from one form to another. (D) The particles of matter move closer together.,,Train
Mercury_SC_416101,416101,1,D,1,0,Mercury,3,2015,Plants on hills keep dirt in place during a rain storm. Plant roots grow into the dirt and keep the dirt from moving. Why do roots grow into the dirt? (A) to release gases (B) to release water (C) to absorb energy (D) to absorb nutrients,,Train
NYSEDREGENTS_2007_8_12,12,1,1,1,0,NYSEDREGENTS,8,2007,"In animal skin tissue, cell division is responsible for (1) growth and repair (2) sexual reproduction (3) obtaining energy (4) production of sex cells",,Train
Mercury_7239680,7239680,1,A,1,0,Mercury,9,2015,Which process drives most of the ATP synthesis in a chloroplast? (A) flow of protons across an electrochemical gradient (B) flow of tRNA across an electrochemical gradient (C) exposure of ADP to electromagnetic waves (D) exposure of carbohydrates to electromagnetic waves,,Train
NAEP_2000_8_S21+9,S21+9,1,A,1,0,NAEP,8,2000,"Which of the following is most consistent with the modern theory of evolution? (A) Parents pass their physical traits to their offspring; those offspring with traits that help them survive in the environment are able to reproduce. (B) Parents change their physical traits in order to survive in the environment, then those parental traits are passed to their offspring. (C) Life on this planet came from another planet far out in space. (D) Living organisms have not changed for hundreds of millions of years.",,Train
Mercury_7164115,7164115,1,B,1,0,Mercury,8,2015,Felicia investigated whether water color affected how fast the water heated in sunlight. She poured tap water into five beakers and placed food coloring in four out of the five beakers. Felicia then used a thermometer to measure the temperature of the water in each of the beakers. Which of these was used as control in her investigation? (A) mixing the food coloring in water (B) testing the beaker of uncolored tap water (C) using the same amount of water in each trial (D) testing the colored water samples at different times,,Train
Mercury_7085365,7085365,1,C,1,0,Mercury,7,2015,One process in the formation of sedimentary rocks is when rocks are (A) compressed by moving plates. (B) heated and subjected to high pressure. (C) broken up and deposited in layers. (D) moved up along fault planes.,,Train
AIMS_2008_4_12,12,1,B,1,0,AIMS,4,2008,Western coral snakes have a striped color pattern and are poisonous. Arizona mountain king snakes look like western coral snakes but are not poisonous. The color pattern of the Arizona mountain king snake is an example of (A) camouflage. (B) mimicry. (C) mutualism. (D) parasitism.,,Train
Mercury_400056,400056,1,A,1,0,Mercury,6,2015,Which plant trait is inherited? (A) the shape of its leaves (B) the amount of water it receives (C) the number of minerals it absorbs from soil (D) the level of sunlight to which it is exposed,,Train
Mercury_SC_406463,406463,1,D,1,0,Mercury,5,2015,"A student put 200 milliliters (mL) of water into a pot, sets the pot on a burner, and heats the water to boil. When the pot is taken off the burner, it contains only 180 milliliters (mL) of water. What happened to the rest of the water? (A) It was used up. (B) It condensed. (C) It was absorbed by the heat. (D) It turned into water vapor.",,Train
Mercury_SC_408702,408702,1,A,1,0,Mercury,4,2015,Howie put his plants under a plant light. What was he helping his plants do by providing light? (A) make food (B) attract insects (C) release pollen (D) grow roots,,Train
Mercury_406518,406518,1,D,1,0,Mercury,8,2015,"Which lists the diameter of the planets in order from smallest to largest? (A) Venus, Earth, Mercury, Mars (B) Earth, Mars, Venus, Mercury (C) Mars, Mercury, Earth, Venus (D) Mercury, Mars, Venus, Earth",,Train
Mercury_SC_410872,410872,1,B,1,0,Mercury,5,2015,The aloe plant can absorb a lot of water during a rain shower. The extra water is stored in its leaves. The ability to store water in its leaves is most likely an adaptation to which type of environment? (A) one near the ocean (B) one with dry conditions (C) one with a variety of organisms (D) one that receives a lot of sunlight,,Train
Mercury_7107258,7107258,1,B,1,0,Mercury,8,2015,"When stratospheric ozone levels are reduced, the amount of ultraviolet radiation hitting Earth increases. Ozone depletion is most often caused (A) by the reversal of the magnetic field of Earth. (B) when fluorocarbons are released into the atmosphere. (C) when electromagnetic waves from the Sun increase. (D) by abrupt changes in weather and climate patterns.",,Train
MCAS_2010_5_11992,11992,1,D,1,0,MCAS,5,2010,Owen tested a physical property of a mineral. He rubbed a mineral sample on a piece of white tile. The mineral left a red mark on the tile. Which of the following physical properties of the mineral was Owen most likely testing? (A) cleavage (B) hardness (C) luster (D) streak,,Train
TIMSS_2011_4_pg91,pg91,1,B,1,0,TIMSS,4,2011,Which of these animals has a young form that looks the most like the adult form? (A) moth (B) human (C) frog (D) butterfly,,Train
Mercury_7093275,7093275,1,D,1,0,Mercury,8,2015,Two tectonic plates pushing toward each other cause intense heat and pressure in Earth's crust. Into which will crust material be changed by heat and pressure? (A) fossils (B) sediments (C) igneous rock (D) metamorphic rock,,Train
Mercury_7083493,7083493,1,A,1,0,Mercury,7,2015,A student states that plants grow taller when grown in natural light than they do in artificial light. Which method is the best way to determine if the statement is fact or opinion? (A) conduct a controlled experiment (B) discuss the statement with other students (C) ask several teachers their thoughts (D) propose a scientific conclusion,,Train
